1256193811431438,"   THANH XUÂN KHÔNG PHẢI LÀ THỜI GIAN MÀ LÀ CẢM XÚC - đúng là thật Được nhận xét là 1 người có đôi chân hay chạy và đôi tay hay làm nên chẳng có gì ngạc nhiên khi còn là “thanh niên” (1 cụm từ dành cho em khi chưa lấy chồng ) luôn tranh thủ những kỳ nghỉ phép, những khoản tiền tiết kiệm từ những tháng lương đi làm để dành riêng cho mình những chuyến đi chơi rong ruổi. Khi thì đi 1 mình, khi thì đi cùng 1 vài người bạn thân.  Đúng là Việt Nam có rất rất nhiều điểm đáng để đi, để khám phá và để trải nghiệm những điều thú vị. Và Đảo Lý Sơn là 1 trong những điểm đến ấn tượng trong ký ức của mình bởi phong cảnh thiên nhiên cực kỳ hoang sơ và con người cũng bình dị, chất phác như chính phong cảnh nơi đây. Lý Sơn là 1 huyện đảo thuộc tỉnh Quảng Ngãi  Chắc ở đây ai cũng từng nghe đến  “Tỏi Lý Sơn” - 1 đặc sản mà nhắc đến Lý Sơn ai cũng đều nghĩ tới.  Nhưng không phải ai cũng biết đến mảnh  đất này   Với cá nhân em thấy rằng du lịch Đảo Lý Sơn phù hợp với những người yêu thích khám phá, thích sự tự do và thích những chuyến phiêu du, phượt , còn với những ai thích du lịch nghỉ dưỡng theo khuynh hướng hưởng thụ thì có lẽ không phù hợp lắm (quan điểm cá nhân).  Em Đến Lý Sơn vào những ngày đầu tháng 8 (Đảo Lý Sơn nằm tại dải đất miền Trung, do vậy thời điểm tuyệt nhất để bạn khám phá hòn đảo xinh đẹp này từ tháng 6 đến tháng 9)  Lý Sơn gồm có 2 hòn đảo chính có người ở: Đảo Lớn (hay Cù Lao Ré) và Đảo Bé Để ra đây bạn cần trải qua 2 lần đi tàu (khá là say ) nhưng bù lại là những cảnh thiên nhiên hoang sơ và thoáng đãng và rất bình yên. Chọn cách di chuyển bằng phương tiện xe máy (thuê xe máy) để khám  phá các điểm đến ở đây Rất may mắn cho chuyến đi thời tiết ủng hộ, không mưa bão và nắng cực đẹp nên khi lên tới Chùa Hang có những bức ảnh siêu đẹp đi vào lòng người.  Tản mạn về Lý Sơn có lẽ giống như việc được ăn 1 món ăn hợp khẩu vị, nên có thể hợp với mình nhưng không hợp với người khác. Nhưng nếu còn trẻ tuổi, chưa vướng bận chồng con thì nên thử 1 lần trong đời ^^. Cảnh ấn tượng nhất trong chuyến đi có lẽ là cảnh ngắm bình minh trên đảo, ngắm hoàng hôn qua cổng Tò Vò, và nhìn toàn cảnh Đảo Lớn trên cột cờ,  Ngắm khung cảnh rất bình yên và thanh tịnh, rất mát khi đến Chùa Hang, và đặc biệt cảnh tưới nước cho cả đảo tỏi vào buổi sáng sớm  Nhắc đến món ăn thì ở đây không có quá nhiều món đặc sắc (quan điểm cá nhân). Cũng có ăn hải sản dù không nhiều và đa dạng, ăn bánh ít gai, ốc tượng, chả cá,...  Nhưng đến đây không thể không thử món:   Lý Sơn nổi tiếng là “Vương quốc tỏi” nên rất nổi tiếng với món gỏi tỏi, cách làm món ăn này khá đơn giản.  Chọn những cây tỏi đực - nghe thì có vẻ buồn cười, tỏi mà cũng có đực với cái  (tỏi đực có củ nhỏ xíu chứ không có múi có tép như các cây tỏi bình thường. Củ tỏi đực thẳng đuột như củ kiệu, bộ rễ thì dài và thân trắng)  Người dân nơi đây không nhổ hết đi 1 lần mà nhổ dần làm gỏi ăn. Nghe thì tưởng sẽ lẫn với: cá, thịt, tôm,... nhưng không, gỏi tỏi là chỉ có tỏi nhé   Nhớ lại cách làm gỏi tỏi được cô chủ của homestay nhỏ nơi mình đến rất nhiệt tình giới thiệu. Cách làm – Cây tỏi rửa sạch, cắt bỏ phần lá và rễ. Phần thân chẻ ra làm đôi, làm ba - Hấp tỏi chín tới.  - Phi thơm hành (dùng hành tím sẽ thơm) với dầu ăn.  - Đậu phộng rang vàng giã nát thêm chút đường, bột ngọt, nước mắm, ớt xắt nhuyễn, trộn chung với phần tỏi đã hấp chín. Thêm hành tím phi vàng lên trên, trộn đều tỏi và các gia vị nêm vừa ăn. – Nước sốt: Nước cốt dừa nấu sôi với chuối và cà chua xắt nhuyễn. Hòa bột năng cho nước sánh nhuyễn, thêm đậu phộng rang giã nhỏ và nêm gia vị cho vừa ăn. – Bày món gỏi ra đĩa (vì ở nhà cô không có đồ đẹp, mà đang đói nên cũng bầy nháo nhào chứ không chưng đẹp ra như ở nhà )  - Dọn kèm chén nước sốt, bánh tráng nướng và rau thơm. Khi ăn dùng bánh tráng xúc gỏi và chấm thêm nước sốt. Món GỎI TỎI khá lạ miệng, giòn ngọt không có mùi tỏi như tưởng tượng ăn tỏi ta đâu ạ.  Đến với Lý Sơn chắc có lẽ hiếm có ai lại không mang theo 1 vài cân tỏi (1 nhánh, hay nhiều nhánh) về làm quà cũng như dùng ăn dần Tỏi Lý Sơn có hương vị đặc biệt có lẽ do thổ nhưỡng, canh tác truyền thống, thời tiết địa phương. Đặc trưng nhất là tỏi Lý Sơn  có vị cay dịu chứ không cay nồng như tỏi khác.     "
1257978777919608,"THỨC GIẤC TRÊN MÂY    Từ bé khi mình đọc những trang truyện cổ tích, những ngôi làng, những khung cảnh nên thơ cứ in đậm trong ký ức.  Rồi một ngày Ông xã đưa mình đến đây (bí mật để mình bất ngờ, cứ bảo xách ba-lô theo Anh, chứ không nói trước là đi đâu), đến nơi, quả thật là vỡ oà vì mình như được bước chân vào cung đường cổ tích vậy. Nơi mình dừng chân đầu tiên khi đến Sapa là Topas Ecolodge. Nằm ở độ cao 900m so với mực nước biển, nhưng lại có một bể bơi vô cực như giao thoa với bầu trời mà nước lại ấm quanh năm. Cung đường đi đến Topas cũng rất kỳ thú: có đoạn đường thì sương mù kín lối, khi thì bên núi bên vực cheo leo, hay băng qua bản làng, và đặc biệt không thế thiếu trong khuôn hình đó là hình ảnh của rất nhiều ruộng bậc thang. Vậy nên đi vào mùa thu lúa chín sẽ rất là đẹp. Nơi này được xây dựng trên hai ngọn đồi hình nón, bao quanh là mây và thung lũng nên rất dễ có những tấm ảnh chất lừ dù bạn có chụp tệ đến đâu  Sau đó Chị Em chúng mình có thể ghé thung lũng Mường Hoa, bản Cát Cát,...và đừng quên checkin đỉnh Fansipan nhé, đường lên ĐỈNH sẽ không làm bạn thất vọng và liên tục hú hét sung sướng Trên đường về Hà Nội, bạn đừng bỏ lỡ cung đường đèo Ô Quy Hồ để tiện thể checkin Mù Cang Chải. Hôm mình đi bị mưa nên không chụp được ảnh nhưng ngắm thôi cũng làm tim xao xuyến ấy, ấn tượng nhất với mình đó là ruộng bậc thang ở khắp mọi nơi (đi vào mùa lúa chín hoặc mùa nước đổ là đẹp nhất), và cứ đi một đoạn lại bắt gặp những thác nước chảy từ sườn núi xuống rất thơ, và một Con sông uốn lượn theo suốt cung đường! Hùng vĩ và đẹp ngây người. Về món ăn thì Sapa nổi tiếng với: cá hồi, thịt trâu gác bếp, lợn cắp nách, cơm lam, rau tươi rói,...nhưng mấy món ấy có thể tìm thấy ở nhiều nơi khác, chỉ có Gà đen, Thắng Cố, Sâu chít,...là những đặc sản Tây Bắc sẽ khó có cơ hội ăn nếu không đến Sapa. Vậy nên thử một lần cho biết ha. Mọi người cùng theo chân mình khám phá Sapa nhé!     "
1258239611226858,"Chào YÊU BẾP, Sắp tới Xmas rồi, các bạn đã có ý tưởng về quà tặng cho người thân chưa? Hôm nay mình gợi ý một món quà home-made đơn giản nhưng yêu thương vô cùng, đó là “OLIVE OIL AROMA (dầu oliu ướp hương).  Loại dầu này được chế biến trên nền dầu ô liu và ướp thảo mộc (như lá hương thảo, cỏ xạ hương, tiêu, tỏi, ớt...v...v). Thường khi đi ăn đồ Tây, trong lúc chờ món khai vị, nhà hàng có thể phục vụ bánh mỳ ăn kèm loại dầu này (thay vì bơ - chất béo động vật). Hoặc một số nhà hàng sẽ để sẵn trên bàn để bạn tưới dầu cho món pizza đúng kiểu người Ý. Nhưng nhìn chung các nhà hàng sẽ không hào phóng đâu - nếu là dầu do họ tự làm.  Mình không mua OLIVE OIL AROMA ở siêu thị vì các hãng thường dùng hương hoá chất để giảm chi phí và không biết chất lượng dầu oliu như thế nào. Chính vì vậy mình tự làm ở nhà. DỄ LẮM bạn ơiii! 1. NGUYÊN LIỆU: - Dầu oliu (BIO thì càng tốt), nên làm 300-500ml thôi để thử đã nhé. Nên tiêu thụ trong vòng 7-10 ngày rồi làm mẻ mới, không nên để lâu. - Loại thảo mộc bạn muốn ướp cùng, ví dụ: lá hương thảo, cỏ xạ hương, húng tây, tỏi, tiêu, ớt.....). 2. CÁCH LÀM: ƯỚP DẦU LẠNH: áp dụng với lá tươi.  - Chọn loại lá bạn thích, rửa sạch và hong thật khô tầm 1-2 ngày để đảm bảo lá không còn đọng nước nhé.  - Tỏi: khô, bóc vỏ nhưng giữ lại 1 lớp áo, rạch 1-2 đường - Ớt: lau khô và rạch 1-2 đường, thích ăn cay bao nhiêu là do bạn nhé.  - Tiêu hạt đập dập CHO TẤT CẢ NGUYÊN LIỆU TRÊN VÀO CHAI THUỶ TINH (đã tiệt trùng và làm khô), sau đó đổ dầu oliu ngập nguyên liệu. Đậy nắp và để nơi thoáng mát ít ánh sáng ít nhất trong 2 tuần nhé. Món này đòi hỏi sự kiên nhẫn. Thi thoảng mở nắp chai dầu ra hít hà kiểm tra hồi hộp lắm luôn. Thử tưởng tượng “bánh mỳ chuột” nóng hổi chấm dầu thơm ngát cay dịu ăn kèm chút phomai và thịt nguội - quá hoàn hảo trong lúc chờ bữa tối ngày đông giá rét. ƯỚP DẦU NÓNG: áp dụng cho lá khô và 1 số lá khó tính (rau mùi ta, rau húng tây) - Chọn loại lá khô bạn thích, đảm bảo sạch và không bụi bặm nhé  - Tỏi, ớt, tiêu: vẫn như trên LÀM NÓNG DẦU 60 độ C rồi cho các nguyên liệu trên vào để trên bếp tầm 3-5 phút. Sau đó tắt bếp, để dầu nguội, đổ qua phễu lọc vào chai thuỷ tinh và dùng được ngay. (nhưng mình thường chỉ bỏ lá đi thôi còn giữ lại mấy nguyên liệu kia cho đẹp) Cách này đỏi hỏi bạn phải có nhiệt kế nấu ăn để đảm bảo nhiệt của dầu nhé.  Mình thích cách 1 hơn vì mình mua được lá tươi dễ dàng.  Mình sẽ đưa cho các bạn một số version ướp dầu để bạn có lựa chọn nhé, mời các bạn xem ảnh."
1258023887915097,"   HỦ TIẾU MỸ THO Miền Tây có một điểm đến mà tên gọi gắn liền với một món ăn đã trở thành đặc sản, đó chính là HỦ TIẾU MỸ THO- được xếp vào hàng đặc sản tiêu biểu của ẩm thực ba miền.  Mình lớn lên tại vùng đất Gò Công thuộc tỉnh Tiền Giang, tuy chưa ăn trực tiếp tô hủ tiếu trứ danh được nấu bởi các quán hủ tiếu lâu đời nổi tiếng tại thành phố Mỹ Tho, nhưng món hủ tiếu đối với dân xứ mình nó cũng vô cùng thân quen, đến độ người ta bảo “chán cơm thèm phở” thì xứ em người ta nói “chán cơm thèm hủ tiếu” đấy ạ!  Về miền Tây mời mọi người dừng chân tạt vào TP Mỹ Tho thưởng thức món Hủ Tiếu để chuyến đi thêm đủ đầy trọn vẹn nhé!  Cách kết hợp nguyên liệu để nấu hủ tiếu cũng vô cùng đa dạng: xương ống, chân giò, lòng (tim, lưỡi, gan, phèo), cho đến hải sản (tôm, mực), gà, bò viên, trứng cút…  Hôm nay em xin mời cả nhà một tô HỦ TIẾU THẬP CẨM (Nấu theo kiểu hủ tiếu Nam Vang) NGUYÊN LIỆU:  *Nấu nước dùng: Xương ống, tôm khô, mực khô, củ cải trắng, vài củ hành tím *Tim, gan, thịt xay, tôm, trứng cút *Giá, hẹ, hành lá, cần tàu, chanh, ớt, tỏi *Muối, bột ngọt, đường phèn (sẽ cho vị ngọt thanh hơn), nước mắm (có hoặc không tùy thích-mình không dùng vì nước mắm tuy giúp nước được đậm đà song lại có hậu làm nước dùng bị chua, và ngả màu đôi chút) CHẾ BIẾN: - Xương ống trụng nước sôi 3-5phút sau đó mang đi rửa lại nước lạnh cho thật sạch, mang đi nấu nước dùng cùng củ cải trắng, mực khô nướng, tôm khô ngâm rửa sạch + vài củ hành tím nướng (có nơi cho thêm củ sắn hoặc mía lau vào hầm nước dùng cho thanh ngọt). Để xương ra hết được chất ngọt thì thời gian hầmxương từ 4-6 tiếng, trong quá trình nấu cực kỳ lưu ý trong 1 tiếng đầu cần canh lửa và vớt bỏ bọt để nồi nước dùng được trong (sơ hở là hỏng cả nồi nước dùng) - Nêm nếm với các gia vị bên trên cho hợp khẩu vị. - Tim, gan luộc với ít mắm muối bột ngọt cho đậm vị (cho thêm ít giấm vào nồi nước luộc để thành phẩm không bị đen) - Tôm + trứng cút luộc lên và bóc vỏ - Thịt xay hòa với ít nước dùng bên trên và đảo trên bếp với ít muối bột ngọt cho tơi ra (có thể xào với ít dầu phi hành tỏi tuy nhiên cách này cũng dễ làm phần thịt xay bị khô-ngả vàng) THƯỞNG THỨC: - Cho ít giá-hẹ-cần tàu vào tô, trụng sơ hủ tiếu hơi mềm cho lên trên (lưu ý không trụng kỹ vì sau đó phần nước dùng sẽ giúp hủ tiếu tiếp tục mềm thêm). Xếp tôm, tim, gan, thịt xay, trứng cút vào tô, chan nước dùng vừa đủ, rắc ít hành lá, hành phi, tỏi phi, tóp mỡ (nếu có), tiêu xay. - Thêm vài lát ớt, vắt miếng chanh vào và thưởng thức! - Món hủ tiếu sẽ ngon hơn nếu có lọ tỏi cắt lát + ớt sừng cắt lát ngâm giấm đường. Riêng vùng Gò Công có thêm một món ăn kèm độc đáo nữa, đó chính là củ cải trắng cắt hạt lựu + ớt sừng ngâm giấm đường ăn kèm. (nhiều lúc mình đi ăn hủ tiếu chỉ để ăn cái lọ cải ngâm giấm đường cùng vài lát ớt ) Thông tin thêm về món ăn đặc sản này: *Hủ tiếu được sản xuất trên vùng đất lúa Mỹ Phong-Tp Mỹ Tho với thành phần chính từ gạo Gò Cát (một giống lúa dài ngày) làm ra sợi hủ tiếu nhỏ, dai, giòn, không mặn, không chua, vị đậm đà, khi trụng vừa nước sợi hủ tiếu không bị kết dính nên có thể làm hủ tiếu khô, hủ tiếu nước, hủ tiếu xào …đều ngon. Đặc biệt hủ tiếu hoàn toàn không có chất phụ gia bảo quản, gạo sau khi xay thành bột mang đi tráng bánh và đem phơi nắng tự nhiên, do đó chỉ có thể sử dụng được trong đôi ba ngày. *12/2008: Cục sở hữu trí tuệ Bộ Khoa học công nghệ cấp giấy chứng nhận bảo hộ thương hiệu độc quyền cho thương hiệu HỦ TIẾU MỸ THO *07/2013: Liên hiệp các hội Khoahọc kỹ thuật Việt Nam trao cúp vàng chứng nhận sản phẩm đạt chất lượng vàng của thương hiệu Việt hội nhập WTO cho sản phẩm Hiểu Tiếu của làng nghề Hủ Tiếu Mỹ Tho. *03/2014: Tổ chức kỉ lục Châu Á trao cúp và chứng nhận HỦ TIẾU MỸ THO là món ăn đạt giá trị ẩm thực Châu Á.    "
1257361487981337,"E mới hoàn thành xong 20kg bánh chả ủng hộ đồng bào miền Trung ạ ke ke. E là sinh viên tiền không có nhiều chứ sức thì e dư . Bánh chả là món bánh truyền thống ạ, e có bổ sung thêm các loại hạt dinh dưỡng và ruốc thịt, nên chất dinh dưỡng được tăng lên và theo e cảm nhận thấy ngon hơn bánh chả truyền thống. Hạn sử dụng bánh được lâu nên cũng yên tâm phần nào hihi. Khoảng 10-14 ngày tuỳ điều kiện bảo quản Nhân bánh chả của e giống với bánh trung thu thập cẩm, nên chị em nào còn nhân bánh thập cẩm có thể làm vài mẻ gửi vào miền trung cũng được đó ạ. E xin up công thức bánh chả, e có tham khảo ct bánn chả của chị Chu Quyên và có 1 chút xíu thay đổi ạ. Hi vọng chị em mình chung tay góp chút sức lực giúp đỡ bà con, quyết chiến quyết thắng  A. Nước đường bánh chả - 1kg đường vàng - 0,5l nước Đun sôi nước sau đó cho đường vào, đun sôi đến khi tan hết đường, đun thêm khoảng 10-12p. Tắt bếp đợi nguội hoàn toàn mới làm bánh. Nước đường còn thừa có thể để tủ lạnh hôm sau làm tiếp B. Nhân bánh Như truyền thống thì bánh chả chủ yếu được làm từ mỡ đường, nhưng do e ko thích mỡ lắm nên đã giảm lượng mỡ xuống 1 chút, và tăng tỉ lệ hạt khác ạ. - Mỡ đường: 100g ( ct truyền thống là 120g) - Lạp xưởng: 80g - Hạt điều: 80g - Vừng rang: 50g - Đậu phộng: 40g - Ruốc thịt: 40g - hạt bí xanh: 30g - mứt chanh + mứt gừng: 30g - mứt sen: 50g - ngũ vị hương: 3g - lá chanh: 3g Hỗn hợp sốt: - rượu mai quế lộ: 15g - rượu trắng: 15g - nước lọc: 25g - nước đường bánh dẻo: 30g Bột liên kết: 50g bột bánh dẻo Các loại hạt giã nhỏ, lạp xưởng cắt nhỏ, trộn nguyên liệu vào thật đều. Trộn hỗn hợp sốt vào, sau đó trộn bột bánh dẻo. Cho lên bếp xào với lửa nhỏ để hỗn hợp dẻo 1 chút. Tắt bếp. Khi hỗn hợp còn ấm thì cho lá chanh C. vỏ bánh - 50g dầu ăn - 210g nước đường Đánh hỗn hợp này trước - 320g bột mỳ - 1g baking power Cho vào trộn đều, hỗn hợp như vỏ bánh trung thu đó ạ D. tiến hành làm - cán bột ra và cho nhân, cuốn vào. Sau đó cắt thành các miếng bánh vừa ăn, xếp vào khuôn - nướng; lần 1: 190 độ - 13p, cho bánh ra ngoài đợi nguội, quét trứng + 3 giọt nước hàng lên bề mặt bánh, cho vào lò nướng lần 2. Lần 2: 160 độ - 10p - Đợi bánh nguội cho vào túi zip E. Một số lưu ý - Cho bánh vào túi zip nên để hói hút ẩm, dán băng chặt ở miệng túi, mục đích tránh cho nước vào thôi ạ. Nên ghi nsx để mọi ngừoi biết ạ Bánh này rất dễ làm mà e nghĩ dễ ăn hơn mì tôm sống, 1 túi bánh này + chai nước là cả nhà đủ 1 bữa rồi ạ.  TẤT CẢ VÌ MIỀN TRUNg YÊU THƯƠNG "
1258028967914589,". : Mỗi độ thu về, trong những khu vườn nhà vùng nông thôn Phú Yên lại nở rộ lên một loài hoa dân dã mà chứa đựng bao tinh túy của hồn quê. Đó là bông giờ, một loài hoa mỗi năm chỉ nở một lần vào mùa mưa. Một sáng mùa thu, khi bắt đầu có mưa bay bay nhè nhẹ, ngoài vườn những bụi hoa sắc tím nhụy vàng bắt đầu nhô lên từ lòng đất và bắt đầu hành trình nở hoa cống hiến những hương vị đậm hồn quê cho vùng đất xứ nẫu - hương vị nồng nàn cho những bát canh rau dân dã tập tàng thơm ngát. Có lẽ bông giờ là loài hoa duy nhất có đặc điểm hiếm thấy là từ đất mọc lên đã là hoa, từ hoa nức ra lá, khi lá sum suê cũng là lúc hoa tàn. Hoa chỉ nở vào mùa thu và chỉ một lần nở khi gặp một cơn mưa làm mềm đất. Đất sinh ra hoa, hoa tạo ra lá.  Hoa - lá  của bông giờ đều có thể dùng để nấu canh, củ bông giờ ngày xưa dùng chế biến thành bột huỳnh tinh để dành chữa bệnh kiết lỵ hoặc dùng uống giải nhiệt, cấp cứu khi bị thương hàn, nóng sốt. Bạn có thể nấu lạc, nấm, tôm, thịt, cá với rau tập tàng như: rau dền, bồ ngót, lá bát, rau má, ngọn lang,...với một ít bông giờ, hay thậm chí nấu chay rau tập tàng với bông giờ cũng đủ đậm ngát hương. Bông giờ màu hoa tím nhuỵ vàng rất đẹp, canh bông giờ tập tàng - thực phẩm âm (tính hàn) trung hoà với món gà kho xả - một món đặc sản quê tôi nhưng là thực phẩm dương (tính nhiệt) là bộ đôi khá hoàn hảo. Quê tôi chỉ có 2 mùa nắng - mưa, năm nay thêm 2 mùa Covid-19 và bão lụt nên cứ quan sát bông giờ nở là khi bạn biết bắt đầu mùa mưa và mùa mưa bão kết thúc cũng là lúc bông giờ đã cống hiến xong sứ mệnh của mình. Chỉ còn những chiếc lá lặng lẽ xanh ngoài góc vườn nhà, không cần chăm sóc, cứ tự phát tán, lây lan như nấm, mọc chen chúc dưới thân những bụi bồ ngót, dâm bụt để tích lũy nhưng hương thơm tinh tuý nhất cống hiến cho mùa sau. Nếu bạn có dịp ghé thăm vùng đất xứ Nẫu vào dịp thu đến mưa về thì hãy nếm thử món canh bông giờ tập tàng này. Có thể ban đầu bạn sẽ khó nếm đấy nên hãy nói đầu bếp đây là lần đầu nếm thử để người nấu cho 1 ít thôi nhé. Hãy cứ nếm thử vì lần đầu tiên làm chuyện ấy thật là không dễ dàng ) heepKitchen"
1257402161310603,"Em chào cả nhà Yêu Bếp!             Sau khi chia sẻ cách dưỡng và cắm hoa Súng sao cho có được bình hoa mềm mại và quyến rũ, em đã nhận được rất nhiều lời khen ngợi và động viên. Sau đây, em xin chia sẻ cách cắm và chơi một loài hoa cỏ dại, mọc ở ven đường. Đặc biệt, mùa này hoa mọc rất nhiều ạ! Loài hoa ấy có tên Cỏ Mào Gà. Cỏ mào gà sau khi cắt xong rất nhanh héo, nhất là trời hanh khô của Miền Bắc. Về nhà, em thường ngâm vào nước khoảng 1 tiếng. Thân của nó xốp nên hút nước rất nhanh, chính vì thế chỉ một lúc sau nó lại tươi trở lại. - Cách cắm:          Em thường chọn chiếc bình dáng thấp để cắm hoa dạng tròn. Khi cắm, em tỉa bớt lá và tách từng cành nhỏ để cắm. Em chọn các bông có độ rủ nhiều để bình hoa trở lên mềm mại.          Với bình to và cao, em chọn các cành có bông dài và ngắn khác nhau nhưng với bình nhỏ, em thường chọn các cành có bông ngắn để sao cho bình hoa hài hoà và cân đối. - Cỏ mào gà hút nước tốt, em không cần thay nước hàng ngày mà chỉ cần thêm nước khi cần thiết.  Bình cỏ mào gà này có thể chơi được từ 5 đến 7 ngày. Tuy không thơm như những hương hoa khác nhưng nó cũng không kém phần quyến rũ phải không ạ!            Em chúc cả nhà có những bình hoa thật đẹp và những món ăn thật ngon. "
