1261786704205482,"      Bún cá Bắc Ninh - Vị ngon chẳng lẫn đi đâu được!  Nhắc đến Bắc Ninh người ta không chỉ nhắc đến miền quê Quan Họ, vùng đất nhiều làng nghề, lễ hội mà ẩm thực Bắc Ninh cũng là 1 trong những điều khiến con người ta phải nhung nhớ  Ngoài món phở gan cháy Đáp Cầu, bánh phu thê, cháo cá Chín Mười, thịt trâu tươi... thì bún cá Bắc Ninh cũng chính là 1 đặc sản. Vì nó khác biệt, không giống bún cá Hưng Yên hay bún cá Hà Nội  Nước dùng trong vắt, nêm nếm vừa vặn, được ninh từ xương lợn, thêm nhánh gừng và hành khô nướng qua cho dậy mùi thơm nức.  Cá quả được lọc sạch xương, ướp chút gia vị, rán giòn từng miếng to, khi lên bát sẽ được cắt miếng nhỏ vừa ăn, thêm rau cần, thì là và hành lá thái nhỏ, chan nước dùng nóng hổi  ta nói sáng se lạnh mà được ""ôm ấp"" 1 bát bún cá ngon lành thế này thì còn gì tuyệt hơn  miếng cá giòn giòn dai dai ngấm vị không lẫn đi đâu được  Tuỳ khẩu vị mọi người có thể thêm tương ớt, dấm tỏi, hạt tiêu và ăn kèm rau sống, dưa góp cho đưa đẩy  Em là team ""xôi thịt"" nên bát bún cá lúc nào cũng sẽ gọi thêm các topping khác cho đầy đặn: bún cá xương nhừ, bún cá đế thăn, bún cá ốc lươn cũng đều ngon tuyệt mọi người ạ  Giá: 30k - 50k  Chủ yếu bán sáng, tối khó tìm được quán bún cá ngon ạ.  Đc: 1 vài địa chỉ bún cá Bắc Ninh đối với em là ngon nhất, mọi người có thể tham khảo nếu có dịp về Bắc Ninh đi lễ thì ghé qua ăn thử nha  -Bún cá Thực - 125 Thiên Đức, Vệ An  -Bún cá Hương Béo - 26 Nguyễn Văn Trỗi, Ninh Xá  -Bún cá bà Thơm - 127 Rạp Hát, Vệ An       "
1262818557435630,"Nhân dịp sắp đến Halloween, Giáng Sinh và cả một cái Tết âm lịch sắp tới, mình xin được chia sẻ cách làm một loại kẹo rất được ưa chuộng lại cực kỳ dễ làm tại nhà, cũng như hương vị được các bạn trẻ cho tới trung niên lẫn con nít mê tít. Chính là Kẹo Nougat – Kẹo Hạnh Phúc đã được một số các chị em từng chia sẻ qua ạ. Loại kẹo này có vị sữa ngọt nhẹ xen lẫn các loại hạt bổ dưỡng thành ra nếu bỏ qua loại kẹo này cho gia đình bạn thì quả thật là một thiếu sót ấy.240g kẹo Marshmallow (2 bịch loại viên to màu trắng sẽ cho màu đẹp hơn, có thể mua trong Vinmart)80g bơ nhạt ( mình dùng Anchor, có thể mua trong Vinmart)160g bột sữa nguyên kem ( mình dùng sữa bột Newzealand, các bạn có thể dùng bột sữa nguyên kem bất kỳ nha)80g hạt cho mỗi loại hạt: 80g hạt óc chó, 80g hạt hạnh nhân, 80g nho khô, 80g hạt dẻ cười (nhà mình không có hạt dẻ nên đã thay bằng hạt mắc ca) [ mua trong Annam hoặc Langfarm]Các loại hạt mình cho vào khay nướng lót giấy nến nướng 170 độ trong 5-7 phút, có thể nướng trong nồi chiên không dầu, hoặc rang trên chảo đến khi hạt thơm thì lấy ra để nguội. Riêng nho khô thì mình ngâm nước ấm trong 5 phút rồi dùng khăn giấy thấm khô.Mình bắt đầu làm nhé. Bí quyết là làm nhanh tay để kẹo không bị vón cứng lại. Bắc chảo không dính lên bếp bật lửa nhỏ nhất (tốt nhất là dùng bếp điện từ để lửa dễ chịu nhé). Sau đó cho bơ vào, bơ chảy hết thì cho kẹo Marshmallow vào đảo đến khi kẹo tan gần hết thì cho bột sữa vào làm 3 lần và luôn đảo. Mình có cho thêm xíu màu thực phẩm màu xanh lá nhẹ cho nó gợn màu (có thể bỏ qua bước này). Kế tiếp cho tất cả hạt và nho khô vào và trộn lên cho hòa quyện rồi tắt bếp. Cho khối kẹo vào hộp nhựa, cho thêm hạt hạnh nhân lên mặt (có thể bỏ qua bước này), lấy giấy nến phủ lên, cán phẳng đều rồi lấy tấm giấy ra, đậy nắp cho vào ngăn mát tủ lạnh. Sau 5 tiếng trong tủ lạnh thì có thể lấy ra cho lên thớt cắt ngắn dài tùy ý. Gói giấy gạo và cho vào túi đựng kẹo hàn lại để dễ dùng. Kẹo này có thể sử dụng trong 2 tháng nha. Mình có thể dùng xen vào là các loại trái cây sấy dẻo (lưu ý là sấy dẻo nhé vì sấy khô thì nhai không nổi đâu ạ) thay cho vài loại hạt tùy khẩu vị mọi người. Ví dụ như xoài sấy dẻo hay Kiwi sấy dẻo sẽ cho ra những viên kẹo rất bắt mắt luôn. Ngoài ra cũng có thể thêm màu hay bột trà xanh, bột ca cao, hay nước hương vị tùy thích sau khi cho kẹo Marshmallow vào chảo để có loại vị mình mong muốn. Có thể rắc thêm cánh hoa (hoa dùng cho thực phẩm) lên mặt kẹo khi cho vào hộp cán mặt kẹo. Riêng mình không thích nên đã bỏ qua khâu này.Kẹo này để mời khách vào dịp Tết hoặc cho vào hộp giấy đẹp đẹp làm quà biếu vào các dịp đều rất thích hợp. Các bạn nữ làm kẹo tặng cho các bạn nam hoặc ngược lại sẽ cảm thấy rất ngọt ngào, ấm áp luôn. Chúc mọi người thành công với món kẹo Nougat này và cảm thấy hạnh phúc khi ăn kẹo mình tự làm nhé!Em cảm ơn team admin duyệt bài cho em ạ.   "
1265156280535191,"HÀ NỘI MÙA NỒM  Hà Nội đẹp nhất vào mùa thu, mùa nắng vàng lộng lẫy, gió hanh hao se lạnh. Đẹp như một bản tình ca.Ai cũng chỉ tha thiết được đắm mình vào Hà Nội vào mùa thu.Nhưng Hà Nội lại lật mặt nhanh hơn người yêu cũ của bạn. Hà Nội có một cái mùa không ai mê nổi. Mùa ai cũng ghét cay ghét đắng.MÙA NỒM.Những ngày cuối xuân nồm ẩm, vạn vật chảy sũng nước, xám xịt. Độ ẩm không khí lên đến gần 100% tỉ lệ thuận với độ ẩm IC của vạn tâm hồn đang sũng nước, đang bứt rứt, đang khó ở vì thiếu ánh nắng mặt trời lâu ngày. Vạn vật mốc thếch, mềm nhũn, chán chường. Y như một mụ gái già đỏng đảnh khó chiều, lại còn thích lên mặt!Không một ai yêu nổi Hà Nội vào cái mùa khó ở ấy.Ai đến Hà Nội vào mùa này thôi coi như xong. Sẽ thấy một Hà Nội giở mặt, xấu xí, xám xịt, ướt nhoét, cáu cẳn.Hà Nội là thế đấy. Yêu thì yêu điên cuồng say đắm. Ghét thì như xúc đất đổ đi, đừng nhìn mặt nhau.Ấy thế nhưng chính những ngày nồm ẩm mưa phùn gió bấc ấy, lại là khoảnh khắc ẩn mình của những điều kì diệu. Là quãng lặng đang phôi thai những thanh âm không lời của mùa xuân.Ẩn trong những thân cây già đen thẫm ẩm thấp là nhựa sống đang rần rật cựa mình.Ẩn trong đất bùn nhão nhoẹt là mùi mưa xuân đang dịu dàng khuếch tán.Ẩn trong bầu trời sũng nước nặng như chì là gió xuân non mỡn đang ngập ngừng e thẹn.Ẩn trong em, là anh.Mùa nồm ẩm rồi sẽ qua, chẳng chóng thì chầy, để lại những ngày nắng xuân hây hẩy như rót mật. Vạn vật bừng tỉnh khi mùa Xuân bước tới và phủ lên chúng điều kì diệu của sự sống mà nó đang ẩn giấu.  Rồi thì,Mùa nồm khiến hoa sưa bừng tỉnh.Mùa nồm khiến lá vàng bừng tỉnh.Mùa nồm khiến chồi non bừng tỉnh.Vạn vật bừng tỉnh sau mùa nồm.Những vòm hoa sưa trắng muốt, bầu trời cao xanh lộng gió, không khí se lạnh ngọt ngào, những vòm cây đổ lá vàng lá đỏ, những mầm cây mới nhú căng nhựa sống, hoa ban tím hồng trong suốt như lụa, những con đường nhỏ sau mưa bắt đầu vương mùi long não… Hà Nội còn khoảnh khắc nào đẹp hơn thế chăng?Hà Nội là thế đó. Ẩn trong những điều đáng ghét nhất, lại là những gì đáng để yêu nhất.Nhưng, bạn phải là người nhìn thấy, tìm được nó cơ.Cái đáng yêu của Hà Nội mùa nồm, không phải ai cũng tìm thấy được.Để hôm nay, mình chia sẻ với bạn điều bí mật này nhé!Xem xong, nhớ quay lại ngắm Hà Nội những ngày đẹp nhất vào mùa thu, mình đã kể ở đây nha: Nào, giờ thìMình đi!    "
1264864180564401,"    Chào Bếp yêu thương lại là em đây! Lần này nữa thôi em xin chia sẻ một góc các món bánh quê truyền thống trong các dịp đám tiệc ở nhà em và cũng như cả quê em luôn!  Đầu tiên không thể không nhắc đến là bánh Tét. Trước 1 tháng hay vài tuần là nhà sẽ chẻ lát phơi khô để buộc bánh, sẽ đi quanh vườn kiếm dừa khô gom lại đủ dùng, rồi canh me kiếm chừa buồng chuối xiêm ngon đúng ngày gói bánh.  Rồi chuẩn bị nếp ngon, đậu xanh, đậu trắng, mỡ heo. Cái không khí nhà sắp tới đám giỗ, chuẩn bị ra vườn cắt lá chuối, người thân xúm nhau lựa đậu xanh, trẻ con tập lau lá chuối là một niềm vui khó tả Thật sự luôn á Bếp ơi bánh trái đám tiệc gì không biết chớ cái không khí nhà có đám bà con xúm nhau gói bánh, lặt rau, làm thịt.vvv nó rôm rả vui kinh khủng ạ  Món Chè trôi nước của Má em phải nói là tuyệt vời, Má thích tự làm vì tính kỹ muốn viên chè tròn đẹp đều nên tự vò vì có lần 5 người phụ thì ra 5 viên khác nhau Chè màu đẹp thôi rồi luôn ạ, màu tím lá cẩm, cam của gấc, vàng của bí, xanh lá dứa  À còn bánh Bông lan truyền thống nữa, nhà em có nuôi vài con vịt đẻ nên gom trứng lại là đủ làm bánh Bông lan luôn, ở quê 90% là làm bánh bông lan bằng trứng vịt, đường, bột mì. Nhà có cái khuôn nướng êm là cả xóm thay nhau mượn nướng, đánh trứng trong một cái diệm sành và đánh bằng chụp ( ở em kêu vậy á) Lúc mới đập trứng em hăng sai lắm khoái quậy tưng bừng chừng 10 phút là giải bộ kiếm bài chuồn rồi vì cái tay sắp rơi ra rồi. Nhưng các cô các  chị đánh siêu thật đánh không ngơi nghỉ dậy đầy cái diệm luôn Bây giờ mời Bếp mình dạo dạo sơ sơ một số hình ảnh em may mắn lưu giữ được ở những thời điểm khác nhau ạ và lâu lâu giải trí bằng hình ảnh cây cối nhà em!     "
1263722234011929,"   Tôi chưa một lần viết về Hải Phòng - thành phố mà tôi sinh ra và lớn lên, nơi tôi đang sống và làm việc. Có lẽ vì tôi đã quá quen với nhịp sống của Nó  Hải Phòng - người ta thường nhắc tới là thành phố cảng sôi động đầy nhiệt huyết, những con người mạnh mẽ, “không lòng vòng” hay “ăn to nói lớn” nhưng “nói được làm được”. Bởi thế mà tôi luôn tự hào khi là một thành viên nho nhỏ của Đại gia đình này.  Hải Phòng khắc ghi trong trí nhớ mọi người là thành phố rợp trời hoa phượng đỏ, là thành phố của biển đậm màu phù sa. Hơn nữa, Hải Phòng còn được biết đến với VÔ VÀN ĐỒ ĂN NGON  . Nào là bát Bánh Đa Cua đậm đà, nóng hổi. Hay những chiếc Bánh mỳ cay được rưới “chí chương” đặc trưng cay nồng, pate thơm đượm và tráng miệng bằng cốc Chè Thái dai dai, mát lạnh. Kế đến là phải nhắc ngay món Bánh Cuốn, khác với những vùng miền khác, bánh cuốn Hải Phòng được chấm với nước mắm ninh xương đun nóng, vừa ăn vừa suýt xoa, nhâm nhi miếng chả viên, chả cắt rồi lại ới cô bán hàng “cháu xin thêm miếng sườn cô ơi!”. Thêm một món cũng na ná với bánh cuốn đấy là Bánh Bèo, lớp bột dày giòn lại dẻo dẻo được trộn cùng với thịt + mộc nhĩ + hành phi hấp nóng rồi chấm với nước mắm là một thứ quà chiều đưa miệng. Không thể không kể đến tới món ỐC của Hải Phòng, có rất nhiều cách chế biến tạo nên hương vị đặc trưng cho món ốc này, nào là ốc luộc mắm, ốc xào, ốc nướng, ốc trứng muối..... chẹp chẹp thèm quá.  Một món ăn vừa làm mưa làm gió đó chính là Dừa dầm và Cà phê cốt dừa. Ắt hẳn các bác đã biết vì sao nó lại hot như vậy. Vị dừa đã làm tăng thêm vị ngậy, thơm cho từng món ăn mà nó góp mặt. Thêm vào đó một số loại topping đã tạo nên một hương vị hoàn chỉnh. Các bác đã từng ăn Nem Thính chưa? Hãy xuống HP để thử 1 lần nhé! Thịt được làm chín rồi trộn với bì giòn giòn rồi “rắc thính”, cuộn với các loại rau và chấm mắm giấm. Một “bản tình ca” hoàn hảo luôn mọi người ạ !  Kết thúc chuyến “food tour” bằng cốc trà cúc ngọt ngào là hoàn hảo  Trà Cúc các bác có thể uống lạnh hoặc nóng đều đem lại hương vị hoàn toàn khác biệt. Lần đầu tiên thử trà cúc có thể mn sẽ cảm thấy khó uống, nhưng tin mình đi, chắc chắn uống lần 2 lần 3 các bạn sẽ nghiện đấy  Như mình vậy! Nếu có dịp ghé qua Hải Phòng quê hương mình, các bạn hãy thử đồ ăn và cảm nhận con người cũng như cuộc sống nơi đây nhé! Hải Phòng sôi động, mạnh mẽ nhưng cũng rất ấm áp, bình dị     "
1264650707252415,"  Sinh ra và lớn lên tại ngôi làng có nghề gia truyền làm Cốm, tôi cũng không nhớ rõ làng Vòng làm Cốm từ bao giờ, chỉ biết từ đời này qua đời khác, tứ đại đồng đường nối tiếp nhau gìn giữ nghề vất vả này. Hồi bé, ông bà nội còn sống, mẹ tôi kể lấy chồng cũng được làm cốm, rồi chở cốm đi bán tận trên phố cổ, ngày đó những nhà khá giả mới mua được cốm để ăn chơi chơi. Rồi ông bà già sức khoẻ kém, nhà bác cũng vẫn làm, ngày xưa làm cốm giã bằng chân, tuốt lúa cũng bằng chân,...tôi cũng vinh dự giã cốm vì được bác huy động lực lượng.  Người làm cốm nói với nhau ráo mồ hôi là hết tiền, làm ra được hạt cốm dẻo thơm giữ được nguyên vị mộc mạc của cốm không cho bất cứ phẩm màu hóa chất hay hồ đường đánh lạc vị người ăn thì quả thực gian nan vô cùng. Làm ra hạt cốm tươi đã vất vả nhưng giữ được vị truyền thống thì lại càng khó hơn. Không phải người làm nghề nào cũng bảo tồn được đúng quy trình của sản phẩm cũng như không nhắm mục tiêu vào lợi nhuận.  Khách vãng lai qua đường mua tạm chút quà gọi là mua ở làng Cốm, còn khách sành ăn, họ phải vào tận nhà làm nghề, nhìn tận mắt lò rang cốm đang rang với củi nóng hổi, bốc mùi thơm phức, rồi có cối giã hẳn hoi vừa sướng con mắt, vừa đã cái tai, lại thơm hết cả mũi, lại được bà chủ cho ăn thử vốc cốm vừa giã xong...Chao ôi sướng ơi là sướng, chiều chuộng mọi giác quan như thế cơ mà. Dưới đây là các sản phẩm trứ danh làng Vòng gồm: *Cốm mộc tươi *Chả cốm *Xôi cốm *Bánh cốm Các nguyên liệu được lựa chọn tỉ mẩn, cân đo đong đếm với công thức không thể phù hợp hơn, dưới bàn tay điêu luyện, tài hoa khéo léo của các nghệ nhân chính hiệu. Ai chưa ăn thì phải ăn một lần trong đời, còn ai đã ăn thì rõ vị của cốm kết hợp với chả ngon khó cưỡng. Thịt lợn phải là thịt tươi sạch, cốm làng vòng nếp non dẻo thơm tạo ra mẻ chả cốm nức mũi, khách mang làm quà đi xa , biếu người thân ý nghĩa vô cùng. Hà nội thiếu gì của ngon vật lạ, nhưng đi biếu khách thập phương nhất định phải là cốm. Vì chỉ Hà nội mới có, và chỉ Hà nội mới ngon, còn cốm làng Vòng thì là ngon nhất ngon một cách bất bại.  Xôi cốm- một trong các món hảo hạng được làm từ cốm, kết hợp với hạt sen,dừa nạo, nước dừa tươi, đậu xanh ăn vừa ngậy, vừa bùi, vừa béo. Ai đã ăn một lần lại cứ phải mua tiếp mua tiếp để biếu họ hàng anh em, người thân của mình. Phải ăn mới cảm nhận được vị của xôi nó dẻo như nào, kết hợp với các nguyên liệu nó hoàn hảo tuyệt đối ra làm sao. Thực sự không quá để nói đây là một sản vật gây nghiện, hãy cảnh giác nhé, bạn sẽ bị nó hút hồn đấy, tôi thề, tin tôi đi. Không đơn giản vì sao đây lại là món xuất hiện trên mâm cỗ cưới, tiệc, liên hoan của người Hà Nội, họ sành ăn thế nào ai cũng biết rồi ạ, ăn Bắc, mặc Nam mà. Còn bánh cốm nữa chứ, không ăn thì thôi đã ăn thì phải vài cái chứ đùa, cũng nếp non, cũng đậu xanh và dừa mà sao nó ngon lạ lùng như vậy. Ăn xong làm ngụm chè mạn nóng vị chát của chè làm trung hòa vị ngọt của bánh cốm, khiến ta cân bằng vị giác không thể hoàn hảo hơn.Để rồi lại ăn tiếp cái nữa, rồi câu chuyện nó cứ cuốn người ăn và ta say trong vị ngọt bùi nồng nàn ấy. Các tín đồ mê của ngọt nhớ đừng bỏ qua nha. Đám cưới miền Bắc là không thể không có Bánh cốm trong lễ ăn hỏi, chiếc bánh mang ý nghĩa chân tình, thủy chung, vẹn tròn, gói gém sự yêu thương của người  vợ gửi chồng đi làm xa. Và cho đến tận bây giờ chiếc bánh cốm ấy vẫn là biểu tượng vĩnh cửu của tình yêu đôi lứa vượt qua mọi vật chất xa hoa phù phiếm khác.    "
1265011567216329,"#YêuNhấtViệtNamBa khía – Cái tên con vật nghe nó chất phát, mộc mạc và bình dị biết bao. Thật thiếu sót nếu tui không giới thiệu đến bạn bè gần xa cái đặc sản của vùng đất cuối trời của tổ quốc – mắm ba khía.Tui là người Kiên Giang, nhưng nơi tôi ở là vùng giáp ranh với hai tỉnh Cà Mau và Bạc Liêu. Các bạn hãy tưởng tượng, từ nhà tui chỉ cần qua cái con kinh tên là Kinh 80 thước, rẽ sang bên phải là Cà Mau và rẽ sang trái là Bạc Liêu. Nên những sản vật, đặc sản của cái vùng Kiên Giang – Cà Mau – Bạc Liêu nó rất đỗi thân thương đối với tui.Hình ảnh con ba khía nó xuất hiện rất nhiều trong lời ca, tiếng hát khi hát về vùng đất cuối trời của tổ quốc – Cà Mau. Có hẳn riêng một bài hát của anh Bo Đan Trường viết về hình ảnh con ba khía, bài hát dùng hình ảnh con ba khía để nói lên sự thật thà, chất phát, bình dị và dễ thương của con trai miền Tây (hí hí).Và tự hào hơn hết khi gần đây, nghề làm mắm ba khía ở Cà Mau được công nhận là di sản văn hoá phi vật thể của Việt Nam*. Thật đáng tự hào cho một cái nghề truyền thống được truyền qua bao thế hệ của Cà Mau.Nói về nguồn gốc của cái tên ba khía, con vật này nó rất giống con cua đồng, tuy nhiên trên lưng của nó có 3 dấu gạch hay người ta gọi là khía, từ nét đặc trưng này người ta đặc cho nó cái tên dung dị là ba khía.Con ba khía này ngộ lắm, nó sống ở những vùng đất biển ngập mặn, ta có thể tìm thấy nó nhiều ở những gốc cây đước và hằng năm có thường tề tựu lại với nhau như đi trẩy hội, người ta gọi mùa đó là mùa “ba khía hội”. Mùa ba khía hội thường xuất hiện vào thời điểm rằm tháng 7 âm lịch hay những mùa nước lên vào tháng 10, tháng 11 âm lịch. Vào mùa này thì ba khía rất nhiều, thịt rất chắc và đây cũng là thời điểm ngư dân vùng Cà Mau chuẩn bị ghe, xuồng, lu, khạp bắt và muối ba khía.Ba khía mà ngon nức tiếng xưa nay là con ba khía ở vùng Năm Căn, Ngọc Hiển, nhất là ở Rạch Gốc (Ngọc Hiển). Đây là vùng đất ven biển, rừng mắm, rừng đước bạt ngàn, là nguồn thức ăn mà con ba khía ưa nhất. Và nghề làm mắm ba khía cũng nổi tiếng nhất ở cái vùng đất xa xôi này.Nhắc đến mắm ba khía lại là một bầu trời ký ức ùa về. Tui mê mấy món mắm lắm, trong đó có mắm ba khía. Hồi xưa, mỗi lần có mắm ba khía trộn là ăn hết cả nồi cơm. Cái món bình dị này nó gắn liền với những bữa cơm người dân miền Tây sông nước. Món này ăn với cơm trắng, nóng hay nguội đều ngon, nhưng ngon nhất là ăn với cơm nguội. Những bữa đi làm vườn hay buổi trưa đói bụng, bới một tô cơm nguội, hái vài trái chuối sống, ăn với tô ba khía trộn thì ngon thôi rồi, ăn đến ăn bụng vẫn còn muốn ăn.Ngày nay, ba khía đã trở nên phổ biến ở khắp các tỉnh thành của Việt Nam. Khi lên những vùng thị thành, ba khía khoát lên cho mình một chiếc áo mới, không còn là con ba khía của vùng đất bùn lầy, ngập mặn nữa mà là con ba khía ở những nhà hàng, quán ăn lớn. Dù ở đâu, thì cái vị mặn mòi của con ba khía vẫn làm cho con người ta say đắm khi ăn qua một lần. Mắm ba khía rất dễ chế biến, mọi người chỉ cần qua vài bước là có thể nó món mắm ba khía trộn ngon. Đây là cách mình làm:Ở Sài Gòn, mỗi lần đi chợ mà thấy có bán ba khía là tui phải mua về ăn cho đã thèm. Con ba khía ở đây đôi khi không ngon, không chắc thịt như con ba khía vùng Cà Mau nhưng nó cũng làm cho mình đỡ thèm, đỡ nhớ quê.Bạn bè gần xa, nếu chưa từng ăn món ba khía trộn thì hãy thử một lần, tui đảm bảo là rất ngon và có khi là ghiền luôn đấy. Và nếu có dịp đi du lịch đến vùng đất mũi, thì hãy một lần thưởng thức mắm ba khía chính gốc nơi đây nhé.Phải nói rất cảm ơn  đã tạo ra một thử thách tuyệt vời, là cơ hội để những người như mình có thể quảng bá, giới thiệu nét đặc trưng của quê hương đến mọi người.     "
