1258965034487649,"  Saigon- all in one Sài gòn. Tất cả đều có. Xin chào Yêu Bếp, đây là lần đầu tiên mình viết bài. Vì cảm thấy mình như con cá lòng tong đứng cạnh dàn khủng long Yêu Bếp ko có xứng, nhưng lâu lâu admin lại rải mồi dụ, nay ngoi lên đớp thử xem có trúng miếng nào đỡ ghiền không chứ ở dưới lâu cũng buồn.  Mình sinh ra ở Sài Gòn phồn hoa. Nhưng ở với bên ngoại là người Bắc nhiều nên cũng ảnh hưởng hương vị Bắc. Lớn lên có dịp đi du lịch và thưởng thức nhiều đặc sản vùng miền bản thân lại có tâm hồn ăn uống vô độ. Nên nói tới ẩm thực mình rất nhiệt tình. Món ăn qua có thể nấu lại (ngon hay không thì không biết ). Ước mơ ăn cả thế giới bắt đầu hiện hình. Có một đặc ân cho người con gái ham ăn như mình là được ở một thành phố lớn hầu như muốn ăn món ăn vùng miền hay thậm chí là quốc gia nào cũng có. Mỗi lần ra khỏi Việt Nam mình lại thèm như điên mấy món bún, phở, hủ tiếu, cơm tấm, bánh cuốn,... Mình cảm thấy rất hạnh phúc và thoả mãn khi Sài Gòn có tất cả. Trước đây mình làm điều hành du lịch đã từng đi thăm các đại lý ở 13 tỉnh đồng bằng sông Cửu Long. Đến mỗi nơi được đãi bữa ăn đặc sản của vùng đó. Món ăn và con người miền Tây là nổi tiếng nhất trong tất cả. Cá sủng sỉnh chiên giòn, ốc bươu nướng tiêu, cơm cháy ba khía, chuột đồng khìa nước dừa, hủ tiếu Mỹ Tho, thậm chí mình còn được đãi cháo dơi . Mình vẫn luôn nhớ mãi và chép miệng thòm thèm khi nghĩ tới Thắng Cố, cá tầm, đọt su, cơm lam khi ở Sapa. Dê nướng Ninh Bình, Chả mực Hạ Long, bánh tráng thịt heo Đà Nẵng, bánh hoa hồng, mì quảng, cơm gà, cao lầu hội an, đĩa bánh Huế mềm thơm, xíu mại, bánh ướt lòng gà, bánh tráng nướng Đà Lạt, bánh căn, bột lọc Phan Thiết, bánh khọt Vũng Tàu... Sài Gòn thì cơm tấm, hủ tiếu Nam Vang và...kẹt xe ạ.  Sau đây là hình ảnh các món ăn từ Bắc chí Nam, kính thưa các loại bún- miến- mì- phở mình tự nấu để ăn bữa brunch ( bữa sáng và bữa trưa kết hợp) và bữa tối. Vì giờ du lịch thất nghiệp rồi, nên chồng cho ăn ngày 2 bữa thôi ạ .  Xin cảm ơn các anh chị em đồng đạo ẩm thực đã tốn khăn giấy đọc đến đây.     "
1259957447721741,"      Bún cá rô đồng & Canh bồng khoai nấu cá  Xin chào cả nhà Yêu Bếp ạ, lại là em- cô gái 21 tuổi bình thường thích nấu nướng quê Hải Dương đây ạ   Rộn ràng tham gia thử thách mà có lẽ em thích nhất từ khi chân ướt chân ráo vào Yêu Bếp ạ, cảm ơn các anh/chị admin đã tạo ra thử thách lan toả tình yêu ẩm thực quê hương đến mọi miền Tổ Quốc  đầy ý nghĩa... Nhớ về quê hương không chỉ là cảnh là con người mà còn là những món ăn quen thuộc, đặc trưng cho mỗi vùng miền, thể hiện nét đặc sắc hương vị mà phải ăn ở đó mới đúng vị đó, mới “chuẩn “. Là người con của Hải Dương, em rất tự hào với những đặc sản nổi tiếng như bánh đậu xanh, canh bún cá rô đồng, bánh gai, chả rươi ... những món ăn mà ai cũng nhớ khi nhắc về xứ Đông. Bài viết này em xin chia sẻ về món bún cá rô đồng hay còn được gọi là canh bún cá rô - là món ăn quen thuộc bình dị mà chỉ có ở Hải Dương người ta mới cảm nhận hết được cái ngon đúng chất mà không đi đâu tìm được cái hương vị ấy !  Bún cá rô đồng:   Nguyên liệu:  - Cá rô - Rau cải canh  - Cà chua - Tiêu - Gừng - Hành, thì là - Mắm, hành khô - Bún sợi nhỏ  Chế biến:  1. Cá rô đồng sẽ được đánh vảy, làm sạch rồi sóc với muối để bã nhờn trong da cá rô nhả hết. (Sở dĩ phải cạo vảy cá vì vảy cá rô đồng rất cứng có thể gây xước miệng khi ăn và quan trọng khi rim cá vảy cá có thể sẽ nổ) 3. Cá sau khi làm sạch sẽ được để ráo nước rồi mới cho vài nồi luộc. (Luộc cá cũng cần phải chú ý, không cho cá rô vào ngay từ đầu mà phải đợi nước sôi, lửa giữ ở mức vừa phải rồi mới cho cá vào luộc khoảng 10-12 phút cho đến khi cá nổi lên mặt nước, tức là cá đã vừa chín tới, cần phải vớt ra ngay. )  4. Gỡ lấy phần thịt cá, cho hành khô vào xào cùng cá, chút gừng băm nhuyễn và đặc biệt không thể thiếu tiêu để dậy mùi thơm, nêm mắm vừa ăn. 5. Cho cà chua vào nồi xào chín, sau đó cho chính phần nước đun xương và đầu cá vào làm nước dùng, thêm vài lát gừng là đã có nồi nước dùng thơm mùi gừng, ngon ngọt của cá rô.  Khi mọi nguyên liệu đã sẵn sàng, xếp bún sợi nhỏ, các loại rau (thường bún cá rô đồng sẽ được ăn với rau cải canh, có vị hơi đắng nhưng lại rất hợp với cá rô), thịt cá rô đồng rim vào bát rồi chan nước dùng lên thế là đã có một bát canh bún cá rô đồng thơm lừng ấm áp rồi ạ  Ngoài món bún cá rô em xin giới thiệu một món nữa là canh bồng khoai nấu với cá vụn trắng. Cũng không biết món này có ở các tỉnh khác nữa không nhưng từ bé đến giờ đây là món ăn quen thuộc với em lắm  Ngày xưa không biết là món gì, bà em hay nấu mà trước chỉ nấu bồng khoai với cà chua không thôi ý không nấu cá như bây giờ. Nồi canh nóng nghi ngút, ngửi mùi đã thấy ngứa hết cả người mà mọi người cứ ăn ngon lành  thế là em cũng thử thì ôi thôi nó cũng ngon đấy chứ. Bồng khoai nấu mềm mà nó lại có chút nhớt ăn đúng kiểu “ vừa đến môi đã trôi xuống ruột”  chấm chút mắm cáy cay cay ăn với cơm nóng, hương vị này chắc chẳng bao giờ quên... những món ăn mộc mạc giản dị và rất xưa ấy mới là làm em nhớ mãi nhớ mãi khi nhắc về quê hương, nhớ về những con người xứ Đông tần tảo lại thêm tự hào ! Những món ăn ấy đã theo chân những người con Hải Dương đến mọi miền của Tổ quốc và trở thành một đặc sản mà mỗi khi nhắc tới, em lại thấy thêm yêu, thêm nhớ mảnh đất suốt một đời đã gắn bó và lớn lên. Nếu có dịp mọi người hãy ghé Hải Dương để thử những món ăn này nhé. Và em lại tiếp tục đi du lịch với Yêu Bếp đây ạ nhiều món ăn và những chia sẻ vô cùng xúc động và ý nghĩa qua từng bài viết.  Không cần là một bài viết dài, mấy hôm nay nhìn những hình ảnh về đồng bào miền Trung đang phải chống chọi với lũ thôi cũng đủ rưng rưng nước mắt. Khác quê hương nhưng cùng chung Tổ Quốc- may mắn biết bao nhiêu mới có thể sống cuộc sống không lo mưa bão, ăn uống có thể tạm gọi là thoải mái thế này, hãy ngoảnh lại và trân trọng, chia sẻ nhiều hơn... Thương lắm miền Trung !!!  Hy vọng và bình an        "
1260307394353413,"   BÁNH LÁ MƠ Bánh lá mơ ở miền Tây còn có tên gọi khác là bánh lá thúi địt (từ địt ở đây người miền Tây và người miền Nam nói chung thường dùng có nghĩa = đánh rắm nha mọi người ơi ) hay bánh lá mít (vì bánh sau khi được nhồi thành bột thì nắn lên lá mít đem đi hấp). Nghe tên có vẻ hơi bốc mùi nhưng thật ra thơm lắm ạ...haha... Lá mơ ở miền Tây cùng họ với lá mơ lông ở miền Bắc, hình thù lá ốm và dài hơn lá mơ lông. Mình có đi ra Bắc ở vùng nông thôn mình có nhìn thấy lá mơ này ạ. Lá được xay và lọc lấy nước để nhồi bột, lúc tươi lá có mùi hơi hắc nhưng khi hấp chín thì có mùi thơm đặc trưng. Bánh lá mơ thường thân thuộc hơn với người dân ở vùng nông thôn miền Tây. Một loại bánh ăn vặt thú vị, rẻ, ngon, dễ làm. Điều đặc biệt của bánh này ngoài mùi vị đặc trưng của lá mơ thì phải nhắc đến thức chấm đi kèm...đó là nước cốt dừa, một loại gia vị thường xuất hiện hầu như rất phổ biến trong tất cả các loại bánh ở miền Tây.  Bánh thơm, ngọt nhẹ...hoà quyện với nước cốt dừa ngọt ngọt mặn mặn. Ăn vào là nhớ mãi   Mình quên chụp ảnh lá mơ mất rồi nên mọi người muốn biết rõ hơn và tránh nhầm lẫn với lá mơ lông thì search ""lá thúi địt"" nhen     "
1259374374446715,"  Mình có một câu chuyện vui về bánh đa và pizza, mà mỗi khi nhắc đến lại cười nắc nẻ, tóm tắt truyện là chỉ nên chọn một món để ăn thôi, đừng có tham lam nên hôm nay mạnh dạn chọn bánh đa để viết về. Mình gặp và quen chồng ở Hải Phòng, và giống như những người Hải Phòng khác, chồng mình thích ăn bánh đa cua và ở đây thì hầu như mọi người sẽ goi là bánh-đa. Chắc là để được coi là một Hải-Phòng-er chính hiệu thì khi vào quán mọi người có thể gọi “cô ơi, cháu một bánh + màu + nhân mình thích”. Bánh đa thì có nhiều loại lắm, bánh đa cua (loại mà ai cũng biết); bánh đa bò nhừ; bánh đa cá chả … nhưng mình thì không phân biệt bánh đa theo nhân, mình chỉ quen gọi là bánh trắng hoặc đỏ cho dễ nhớ mà thực ra là chỉ nhớ được đến thế. Trước khi bánh đa trở thành một phần của cuộc đời mình thì mình chả bao giờ quan tâm đến cái món này, ôi sao mà nó cứng thế nhỉ, sao ai cũng thích thế, sao ai cũng ăn ngon lành, ai cũng bánh đa bánh đa bánh đa. Rồi đúng kiểu ghét của nào trời trao của đó, chồng mình cuồng bánh đa dữ dội. Anh mệt anh muốn ăn bánh đa, anh đói anh muốn ăn bánh đa, anh vui anh cũng làm bát bánh đa, đêm đêm nằm ngẫm nghĩ lạnh thế này ước gì có bát bánh đa nhỉ hay không nghĩ ra món gì thì thôi lại bánh đa, đến nỗi đi du lịch vào nhà hàng nhà người ta cũng hỏi có bánh đa không? Nhiều lúc cũng hơi cáu hỏi sao lúc nào anh cũng ăn bánh đa thì thở một cái dài thượt xong buông câu khó chịu: “Cuộc đời 1 màu vì chỉ yêu 1 người nên chỉ ăn đúng 1 món”.  Ngày còn đang tán tỉnh cưa cẩm thi thoảng chiều chiều nhắn tin hỏi han nhau vài câu thì đã thấy mùi hành phi tóp mỡ lẫn mùi gạch cua quyện lên trong điện thoại. Có ngày người iu rủ mình vào hàng bánh đa quen ở Hàng Kênh ăn, order dõng dạc lắm: “Cô ơi cho cháu 2 bánh đa”, đang ăn thì chợt nhớ ra cái gì ấy, lại ngẩng cổ lên: “Cô ơi cháu 2 trứng chần nữa”, mình im im ngẫm nghĩ là đã hỏi mình có thích ăn trứng chần chưa mà gọi những 2 quả, nghĩ tiếp xem bây giờ có nên bảo cô bán hàng làm chín 1 quả không thì đã thấy 2 trứng chần ở trước mặt. Dưới con mắt mở to chưa biết làm thế nào của mình thì người iu dấu đã đổ một phát bát trứng chần 2 quả vào tô bánh đa của người ấy mà không một chút lưỡng lự. Lúc ấy vừa quê vừa hài, chả lẽ lại quay xe, nhưng thôi… ghim lại. Người iu hay chở mình vòng vòng thành phố, mà theo thơ của bố viết là: “ta bên nhau dắt con phố đi vòng” rồi chỉ trỏ hàng quán, chỗ này thế này, chỗ kia thế nọ, và gần như chỗ nào được đánh dấu cũng là một địa điểm ăn uống, không khác gì cái bản đồ ẩm thực sống cả, mà 10 lần như 10 văn tả cảnh lúc nào cũng chèn câu: “Chưa thấy cái thành phố nào mà mọi người cứ ‘xì xụp’ đông vui thế này”. Chắc điểm khác biệt lớn nhất của ấm thực Hải Phòng với những nơi khác là cái ‘không khí’ rất dân dã mà cũng sành vô cùng kiểu như ăn món này sẽ đến chỗ này và nhất định, nhất định phải là chỗ đó mới chịu.-chần. Trong tuần phải dậy thật sớm đi xe bus đi làm nên mỗi tối cuối tuần sẽ nằm ngẫm nghĩ sáng mai ăn gì? Ăn bánh cuốn, ăn bánh mỳ trứng đánh kem, ăn bún cá cay hay ăn gì hả chồng, xong sáng mai dậy đảo một vòng cuối cùng lại quay về quán bánh đa cũ…    Đồ ăn ở Hải Phòng rất ngon, rất đặc biệt và chúng mình yêu không khí ở đây. Bao nhiêu lần cân lên đặt xuống liệu có nên chuyển hẳn đến một nơi khác để sống không thì đến nay vẫn chưa quyết nổi, cũng không dám nói là vì bát bánh-đa. Nếu một ngày thức dậy không được cùng nhau vắt vẻo cà phê ăn sáng hay lê la góc này góc kia, chỉ cần nói mình đang làm gì, người kia sẽ tự định vị được location như google map thì sẽ ra sao nhỉ? rứng-chần của chồng đi.  Như ý nhé!    "
1259801184404034,"  Tây Nguyên tháng 3 - Mùa hoa tuyết trắng  Tháng 3, Mùa con ong đi lấy mật Mùa con voi xuống sông hút nước  Tháng 3, Sớm sớm mẹ ra rừng, theo dấu chân rùa, đi tìm nấm mối... Tháng 3 Tây Nguyên thực sự lôi cuốn tôi từ thuở bé bởi những câu hát trên khi bố mẹ tôi bật băng cassette, nghe đài. Khi còn bé, trí tưởng tượng của tôi nghĩ ngay đến việc được vào rừng hái nấm, đi theo vết chân rùa, điều đó thật đáng mơ ước với bọn trẻ con. Và tôi đã đến với Tây Nguyên, trong tháng 3, để được cảm nhận trọn vẹn, để được say với mảnh đất này. Cảm nhận đầu tiên khi đặt chân đến Tây Nguyên đó là 1 bầu trời xanh ngắt, hàng cây xanh mát bên đường, đúng như đoạn mở đầu của bài hát “Tình ca Tây Nguyên”. Chúng tôi có 5 ngày rong ruổi nơi đây, đi qua 3 tỉnh thành của Tây Nguyên là Đắc Lắk, Gia Lai và Kon Tum. Thời gian không nhiều nhưng cũng đủ để chúng tôi cảm nhận và đắm chìm trong cái nắng, cái gió nơi đây. Tôi mê nhất là những con đường Tây Nguyên thẳng tắp, ngút ngàn, lên dốc, xuống dốc đẹp mê ly. Đâu đó cảm giác như những con dốc của miền Trung du quê tôi, nhưng đường dài thẳng tắp thì Tây Nguyên mới có. Những con đường đó còn mê mẩn tôi bởi những rừng cây hai bên đường. Nào là cà phê, cao su, hạt tiêu, bơ, chanh dây, hạt điều,... thật sự thích thú. Mỗi lần nhà tôi đi phượt cùng nhau thì vợ chồng tôi luôn nhắc 2 cô bé ngồi dậy ngắm cây cối, đất trời hai bên đường, để cảm nhận, để biết, học hỏi và cả... để viết văn tả cảnh nữa.  Lần này, điều tuyệt nhất của chúng tôi là được thưởng thức hương hoa cà phê. Chuyến đi anh trưởng đoàn đặt tên là “Mùa hoa tuyết trắng” là bởi lý do đó. Mặc dù là mùa khô cạn, cũng ít vườn cà phê được tưới nước nên hoa cà phê không có nhiều. Tuy nhiên, chúng tôi vẫn may mắn được lạc trong những vườn hoa thơm nức, trắng muốt, đặc trưng của vùng đất Tây Nguyên. Nhờ sự sắp xếp của anh Trưởng đoàn, chúng tôi được tới những nơi đẹp nhất, có những khung cảnh tuyệt vời để săn ảnh, được nghe nhạc cồng chiêng trên ngọn đồi view đẹp giữa đất trời Gia Lai, được gặp cụ già dân tộc tai căng lỗ khuyên to đùng đeo ngà voi vào đó, được ăn những món ngon đặc sắc của mỗi nơi chúng tôi đến... Tây Nguyên xa mà bỗng nhiên thân thuộc để khi về ai cũng thấy nhớ, nghe bài hát trong clip cậu em làm, ai cũng thấy vấn vương: Rồi đi xa thấy nhớ  Nhớ cao nguyên chờ đợi  Mây lang thang đại ngàn  Con suối về đi hoang.  Rồi đi xa thấy nhớ  Đêm cao nguyên lửa trại  Đêm âm thanh của rừng  Đêm rượu cần men say.  Tôi như say tiếng cồng chiêng  Tôi như say hương cao nguyên đại ngàn  Tôi như say đất đỏ bazan  Tôi như say đất trời thênh thang.  Tự dưng cũng mơ mình trở thành 1 cô gái Tây Nguyên, giữa đại ngàn, để được ca giọng vút mây xanh, nghe sao ngọt lành... Tháng ba, trời trong xanh như suối ngàn  Cho em múa hát cho anh đánh chiêng  Chiêng anh rộn núi rừng buôn làng  Em ca giọng vút mây xanh  Chim hót theo nghe sao ngọt lành.  Tháng 3, 2020     "
1257957344588418,"Ăn đẹp và sạch  Mình vốn không phải đứa thích nấu ăn, mặc dù biết nấu và cũng thích ăn ngon. Hồi sinh viên thì hay nấu để tiết kiệm, sau này đi làm thì vẫn có nhu cầu tiết kiệm nhưng lười  tới lúc lấy chồng và sống ở nước ngoài thì công việc quá bận, không có nhiều thời gian nấu nướng nên cũng chỉ thỉnh thoảng mới vào bếp mỗi lần thèm đồ Việt.  Đồ Việt được cái đưa cơm, ăn nhiều nấu nhiều thì cả vợ lẫn chồng đều béo, thế nên mình đến với eatclean để giảm mỡ theo tiêu chí 5 ngày trong tuần ăn sạch, cuối tuần mới xoã.  Được cái anh bạn cùng nhà cũng hưởng ứng, đại loại vợ cho gì ăn nấy, không đòi hỏi, kêu ca, rất dễ nuôi. Lần nào vợ bưng đĩa ra cũng kiểu “ồ lần đầu tiên mình thấy món này”  mình cứ tự hiểu là ủng hộ đi   Mình có mua thực đơn eatclean của healthcoach nhưng sau này quen tay và mò thêm thì cũng tuỳ cơ ứng biến. Ăn theo eatclean mình đánh giá là rất khoa học, đầy đủ chất, và sạch. Một số chế độ ăn khác có thể giúp bạn giảm cân nhanh nhưng mình tin là sẽ thiếu nhiều chất và không giúp cơ thể có thời gian thích nghi kịp thời, cái gì nhanh quá cũng không tốt đúng không ạ  Trộm vía cứ eatclean một đợt là mình tự thấy da dẻ cũng đẹp hơn, người lúc nào cũng nhẹ nhàng  Nguyên liệu để ăn eatclean không hề khó, dù ở nước ngoài hay Việt Nam thì các bạn đều có thể dễ dàng mua được, thịt gà, cá hồi, tôm, mực, hoa quả thì mùa nào thức nấy, bổ sung thêm rau, củ, khoai lang, cái này thì quê chúng mình là thiên đường rồi ạ.  Chia sẻ với chị em 1 số món eatclean mà mình hay bày vẽ, hi vọng giúp mọi người có thêm ý tưởng để hình dung về các món, ngoài ra cũng là thoả chí muốn màu mè hoa lá cho cuộc sống thêm vui tươi   Mỗi lần ngồi chuẩn bị đồ ăn, cắt cắt xếp xếp hí hoáy cũng thấy Yêu Bếp hơn rất nhiều  "
1258931107824375,"    Đi bất cứ nơi đâu trên mảnh đất hình chữ S thân yêu, trong tim tôi đều có những cảm nhận khó tả.Mỗi địa danh là một điểm mới khác lạ .  Hôm nay gửi đến Grup Yêu Bếp một điểm đến đó là Pù Luông - Nơi sẽ cho bạn những cảm xúc đẹp   Pù Luông là một khu bảo tồn thiên nhiên gồm 2 huyện Bá Thước và Quan Hóa nằm ở phía tây bắc tỉnh Thanh Hóa, giáp với huyện Mai Châu, tỉnh Hòa Bình .Pù Luông - một nơi được mọi người hay ví như Bali thu nhỏ. Ta nói cái đường lên đúng là có chút oải.. nhưng khi lên tới nơi thì không khí và cảnh đẹp nơi đây làm cho bạn quên hết mệt mỏi… Nằm vùng núi ở Bá Thước, Thanh Hóa (cách thành phố Thanh Hóa  khoảng 130km) và cách Hà Nội khoảng 170km. Giữa tháng 10 là thời điểm Pù Luông bước vào mùa lúa chín đẹp nhất trong năm!  Đẹp nhất của Pù Luông đó chính là mùa lúa chín ruộng bậc thang. Một năm Pù Luông sẽ có 2 vụ lúa chín: Vào mùa hè tháng 5-6 và vào mùa thu tháng 9,10. Nếu đi Pù Luông vào tháng 6 , lúc này thì thời tiết sẽ hơi nóng, tối sẽ mát nhưng sẽ không phải kiểu mát lạnh đâu, tắm tại bể bơi và thác thì hợp lý vì không bị lạnh. Lúc này lúa đang chuẩn bị ngả vàng, chưa bị gặt.   Còn nếu đi vào tầm gần giữa tháng 10 thì ban ngày trời mát nắng vừa phải, tối thì kiểu mát lạnh. Vẫn có thể tắm tại bể bơi nhưng sẽ hơi lạnh. Lúa thì lúa này chưa bị gặt, đang ngả vàng, có hỏi người dân là khi nào gặt thì họ báo tầm 15-20 ngày nữa sẽ gặt.  Thường thì mọi người sẽ đợi thời điểm lúa chín vàng mới đi, nhưng riêng cá nhân mình thì thích đi vào thời điểm lúa gần vàng vì khi chụp ảnh sẽ đẹp hơn. Với cả nếu căn vào thời điểm chín thì có thể sẽ bị chỗ gặt chỗ chưa??? Khi du lịch Pù Luông, bạn hãy tạm biệt những nhà hàng, quán ăn sang trọng mà hãy chuẩn bị đón chờ những bữa ăn rất đỗi thân thương, gần gũi từ chính chủ nhà thuê. Họ sẽ chiêu đãi bạn những món ngon, đặc sản núi rừng như: gà đồi, ốc Núi (món này mình rất thích ), măng chua, măng đắng, canh rau ngót rừng, cơm lam, nộm hoa chuối rừng, Đặc biệt Vịt Cỗ Lũng thả suối nướng, lợn rừng quay, rượu cần…     "
1168653750185445,"BÒ NHÚNG GIẤMNguyên liệu:Thịt bò( bắp, thăn...)Giấm gạoNước dừaDứa,dưa chuột, cà rốt, chuối xanh, khế chuaRau thơm các loạiSả, gừng, tỏi, hành tâyBún, bánh tráng.Gia vị: Đường, hạt nêmMắm nêm Thuận PhátCách làm:Thịt bò :-Chọn phần bắp hoặc thăn... Rửa sạch, cắt mỏng. Cho vào ngăn mát tủ lạnh bảo quản Rau  - Rau thơm rửa sạch, ngâm nước muối 15 phút vớt ra vẩy sạch nước để ráo - Dưa chuột, cà rốt, dứa, chuối xanh, khế rửa sạch, ngâm nước muối, để ráo, thái sợi-Hành tây : Rửa sạch, thái mỏng-Sả, gừng, tỏi: Rửa sạch thái lát to, tỏi băm nhỏ cho vào bát nước chấmNước giấm nhúng bòCho nước dừa tươi vào nồi, thêm 4 thìa giấm, 2 thìa đường, 1 thìa hạt nêm, thêm vài lát dứa, hành tây thái mỏng, sả, gừng thái lát vào đun sôi, thành phẩm và nồi nước nhúng chua ngọt thanh dịuMắm nêm( Vì ko mua được mắm nêm chuẩn nên e dùng mắm nên Thuận Phát)   Dứa băm nhuyễn, tỏi băm nhuyễn, thêm 3 thìa đường, 1 thìa nước dừa đánh tan, đổ từ từ mắm nêm vào, đến khi thấy vừa miệng là được. Vì mắm nêm TP đã có ớt cay rồi nên e ko cho thêm ớt nữa, mọi người có thể cho thêm chanh để cân bằng lại vị, vì mắm nêm chính là linh hồn của món ăn này quyết định đến 80% độ ngon của món ănNhúng thịt bò vào nước giấm đang sôi, ăn kèm cùng bánh tráng cuốn rau sống, dưa chuột, cà rốt, dứa, chuối xanh, khế, hành tây...chấm cùng nước mắm nêm. Rất đưa miệng mà ko bị ngán đâu ạ-Bún có thể ăn kèm món cuốn hoặc ăn cùng nước giấm chua dịu,ngọt vị nước dừa, thơm mùi dứa, mùi sả, gừng, cực kỳ thanh mátĐây đúng là món ăn dành cho mùa hè này, các tín đồ thích món cuốn như e hãy thử ngay đi nhé, chúc mọi người thành công ạ"
