2996831443769048,"Em có món cá khô một nắng gửi tới mọi người ah. Em phơi thì đơn giản chỉ làm sạch cá và ngâm qua nước muối rồi đem phơi một ngày. Các bác muốn hương vị sả, ớt hay gì nữa thì tẩm ướp trước khi phơi. Em có video cách làm của em đây ah "
2800697286715799,"XOÀI NON XỐC BẠCH TUỘC món ăn vặt cho tín đồ ăn chua làm để tủ lạnh ăn dần xoài thấm ăn càng ngon ạ, linh hồn món này là nước xốt đó ạ mà linh hồn của nước xốt là nước mắm phải ngon. E mời cả nhà ạ Nhìn thôi cũng biết làm rồi mà e để ct đây ai chưa biết thì xem nha! "
2812534435532084,Ai muốn làm bò nướng ngói không ạ link đây nhé mong mọi người ủng hộ mình.  
2809769995808528,"Miến ngan món bình dân mà ngon Trong các loại gia cầm, không hiểu sao ngan lại hợp với miến đến thế. Bồ câu nấu miến cũng ngon, nhưng có lẽ ngan nấu miến là phổ biến nhất. Nếu nấu tại nhà, một bát (tô) sẽ có nhiều thịt ngan, ăn còn “đã” hơn ở quán.  Gửi các bạn tôi: "
3338928426226013,"CÁCH NẤU BÁNH CANH BỘT LỌC______________ 1. Nấu nước sôi trụng sơ bột bánh trong 3 phút rồi vớt ra rổ. 2. Phi hành đến khi vàng và thơm thì cho cà rốt đã thái nhỏ vào, đảo đều khoảng 3 phút. 3. Nêm ít gia vị cho thấm vào cà rốt. 4. Cho nước vào và chờ nước sôi thì cho nấm, rau củ vào. 5. Khi nước sôi, nêm nếm vừa ăn rồi cho bột bánh canh và chả cá vào, khoảng 3 phút sau là tắt bếp và dùng được. Lưu ý: Nấu nhiều nước lèo vì bột lọc có khả năng hút nước và nở ra nên rất nhiều. 1kg bánh canh nấu chung với rau củ đủ dùng cho gia đình 8 người. Có thể nấu nửa kí nếu gia đình ít người, phần còn lại bảo quản ở ngăn mát tủ lạnh được 4 ngày. Có thể thay thế chả cá bằng cá hay tôm, cua, thịt .. tùy khẩu vị người dùng.-  Liên hệ: 0901 419 670"
3337193399732849,
3336943773091145,Ốc bươu xào sả ớt cay   Trời mưa mưa có món này ăn chơi hoặc ăn cơm ngon ngon. Ăn với bánh tráng nướng nữa ngon xuất sắc Nguyên liệu: 200gr ruột ốc bươu  Bột nghệ 1 muỗng canh Sả 3 cây Tỏi 1 củ   Ớt trái 3 quả   Lá chanh 5 lá Danh sách các món ngâm/muối dễ làm: 
3336635699788619,Món rau trọn thật hấp dẫn
3329802073805315,"Sò điệp xào sa tế, ăn vào là ghiền  Công thức đầy đủ"
3225272947591562,"Công thức gỏi Khô Bò Đen kinh doanh.  Gia vị ướp :  1kg phổi Bò,1kg lá mía, 500 gram thịt Bò. - 3 tai vị (hoa hồi) - 3 nụ Đinh Hương - 15 gram muối - 10 gram bột ngọt - 10 gram hạt nêm - 20 gram nước tương - 50 Hắc xì dầu( kipchap) - 1 muỗng cà phê ngũ vị hương - 700 gram đường cát - 300 gram nước dừa tươi - 500 -600 gram nước lọc  - 100 gram dầu ăn - 50 gram sã xay - 40 gram tỏi xay Công thức nước sốt chan gỏi  100 gram giấm đỏ 200 gram nước sôi  250 gram đường 250 gram nước tương. Ăn kèm đu đủ bào sợi ngâm đá cho giòn, lá quế, đậu phộng rang thơm, tương ớt Video hướng dẫn  Cảm ơn admin duyệt bài"
3254150658037124,"Hôm nay xin giới thiệu với tất cả các bạn món ""Cá tra hấp rau răm"" Cách làm:"
3260549440730579,"Chào mọi người,chúc mọi người buổi tối vui vẻ,nhà ai có e nhỏ chắc sẽ rất thích món cookie chocolate này nè,còn người lớn chúng ta ăn bánh uống trà  Nguyên liệu:                 1 bịch cookie mix 485gr                      90gr butter (melt)                      1 trứng gà size lớn Recipe: "
3288796551239201,"Mấy bữa trước mình nấu Canh khoai môn sọ hầm xương heo và tôm tươi. Ngon quá nên hôm nay lại triển Canh khoai môn sọ hầm giò heo. Thật là đơn giản dễ nấu mà ngon quá. Hôm nay mình bỏ ít thời gian Google những công dụng của khoai môn sọ đối với sức khỏe con người: 1. Tốt cho phụ nữ mang thai 2. Tốt cho người tiểu đường 3. Tốt cho người bệnh thận 4. Tốt cho hệ tiêu hóa 5. Tốt cho người ăn kiêng 6. Điều hòa huyết áp và lượng đường trong máu 7. Chữa bệnh viêm khớp, u hạch 8.Hoạt huyết tiêu viêm 9. Chữa tiêu chảy, lỵ 10. Chữa mụn nhọt đầu đinh "
3316136178505238,"Người ta thường nói được miếng ăn hỏng miếng uống, là món ăn ngon mà đồ uống thì không tương xứng. Tương tự, có những món, đồ ăn đã ngon rồi thì bát nước chấm cũng phải xứng tầm thì món ăn mới trọn vẹn. Làm bát nước chấm xoàng xoàng thì dễ lắm, còn làm sao cho ngon thì lại cả một bí quyết. Trong mâm cơm, có món ngon rồi, có bát nước chấm ngon, tự nhiên bữa cơm sôi động hẳn lên, trò chuyện vui vẻ, bữa ăn ngon miệng và ý nghĩa hẳn lên. Vậy mới tài chứ. "
3318242704961252,Canh sake sườn non. Nhịp sống nông thôn  
3329434603842062,"PATÊ CHAY LÀM TỪ CÁC LOẠI ĐẬU xin chia sẻ đến các bạn công thức làm Pate Chay  mới học được từ Sư Cô Tuệ Vân, cực kỳ đơn giản. Chỉ 10p Bạn sẻ có ngay món Pate khoái khẩu ăn cùng Bánh Mì thì tuyệt vời. Mình ghi công thức kèm đường link của Cô bên dưới : Nguyên liệu : - Đậu gà - Đậu đỏ - Đậu trắng - Nấm mối ( trồng ) - Nấm đùi gà - Khoai tây - Củ hành Gia vị : - Bơ lạt - Tiêu xay - Đường - Hạt nêm chay - Nước tương 1) Cho 2 muỗng canh dầu ăn vào chảo, xào hành tây đến khi thơm, ta cho 2 loại nấm vào xào, cho các loại đậu vào, đảo đều hỗn hợp, giảm lửa nhỏ cho gia vị : 1 muỗng cafe hạt nêm, nữa muỗng cafe đường, 1 muỗng canh nước tương Đảo đều hỗn hợp. 2) cắt Khoai Tây đã luộc cho vào hỗn hợp, để lớn lửa và xào hỗn hợp, cho bơ vào và tắt bếp đảo đều cho tan bơ, cuối cùng cho tiêu. 3) Cho hỗn hợp vào máy xay xay nhuyễn, cho hỗn hợp vào khuôn. Có 3 cách là bạn cho vào tử lạnh, hoặc ăn liền, hoặc cho vào lò nướng nướng để thơm hơn. Thật đơn giản phải không các bạn. Đảm bảo rất thơm, rất ngon và hấp dẫn các bạn ạ. Chúc các bạn thành công và ngon miệng "
3129829233802601,Hôm nay em nấu món :       CÔNG THỨC xem ở đây ạ :  Em xin chia sẻ đến cả nhà cách chiên cá sao cho giòn dai đậm đà thơm ngon. Nếu nhà mình ai muốn màu cá vàng đẹp thì mua cá cơm bạc ạ.  Em hay ăn cá cơm than vì toàn gặp cá cơm than tươi rói óng ánh luôn á cả nhà.  Em quan trọng nội dung hơn hình thức ạ hihi.  Món này ăn hao cơm lắm luôn ak.  Ăn ghiền luôn ạ. Gion dai thích lắm ạ.
3129958910456300,"Hôm nay em nấu món :      CÔNG  VÀ CÁCH LÀM XEM Ở ĐÂY Ạ :  Món trứng rán quen thuộc chúng ta  vẫn hay ăn khi được làm theo kiểu Hàn Quốc trông sẽ bắt mắt và hấp dẫn hơn rất nhiều.Cách làm cực kì đơn giản,  nhanh nhưng rất ngon và đầy đủ chất dinh dưỡng. Đặc biệt anh/ chị hay bé nào lười ăn rau thì món này giúp cải thiện được phần nào đó ạ.     VÀ CÁCH LÀM XEM Ở ĐÂY Ạ :  Ở những lần trước e đã chia sẻ rất nhiều cách chiên và hôm nay em xin chia sẻ hai cách chiên khác.  Các anh chị có thể vào kênh của em để xem lại những cách chiên trước nhé.  Nguyên liệu :  Trứng (gà hoặc vịt)  Ớt chuông  Xúc xích  Cà rốt  Hành lá"
3146590648793126,"Đây là khoai mì bào sợi hấp ăn với nước cốt dừa, đậu phộng muối, đường.  Ăn ngon lắm mời mn Cách làm ở đây   Cảm ơn Admin đã cho đăng bài."
3149158905202967,"Chào mọi người,đây là món bánh chuối hấp đỏ miền tây, độ mềm dẻo béo ăn rất là ngon và rất lạ miệng bạn nào chưa biết cách làm có thể làm ăn thử nha! Nguyên liệu:Lớp bánh 700gr chuoi già ~ 7trai   600ml nước lạnh 1mcafe muối  90gr đường, rượu nho 15ml  300ml nước cốt +100ml nước sôi 100gr bột gạo 50gr bột năng  1/4mcafe muối  Lớp mặt bánh    225ml nước cốt dừa 70ml nước lạnh  20gr bột năng ,20gr bột gạo  4mcafe đường 1/4 mcafe muối Recipe: "
3173583532760504,"Xôi gấc lên màu đẹp, dẻo và thơm  Cách nấu của mình   Nguyên liệu: - Nếp hương 1kg - Gấc: 1 quả - Dừa bào - Rượu vang đỏ - Đường - Muối Xôi hấp lên mùi thơm nức mũi. Ăn vào dẻo, thơm, béo. Khi nhai vào sừng sực của dừa bào rất tuyệt. Chúc các bạn thành công Danh sách món ngon dễ làm: "
3189487144503476,"Chào các bạn,món bánh chocolate nướng này ăn lạ miệng mà ngon nên mình chia sẽ lại cho các bạn nè!  Nguyên liệu: 3 quả trứng gà                         180ml sữa tươi                     120gr bơ tan chảy                 1bịch bột chocolate fudge mix 540gr Recipe: "
3186339294818261,"Đây là bún Kèn Hà Tiên, mời mn.   Bún cá này ăn rất ngon, mn hãy làm thử đi. Cách làm ở trong cái video sau. Cảm ơn Admin đã đã cho đăng bài  "
3120542518064606,"Hôm nay em làm món :      Ăn chả cá,  chả lụa,  chả trứng...nhiều rồi hôm nay em làm chả mực ăn cho nó lạ miệng và thay đổi món cho đỡ ngán ạ. E  kinh doanh món bún chả mực cũng có lý cả nhà ha.     VÀ     :  Nguyên liệu : 300gram mực. Chọn mực mai ngon nhất nếu không có thì mực gì cũng được ạ.  100 gram tôm 100gram thịt heo  Tỏi  Ớt  Hành tím  Gia vị"
3111036632348528,"Cảm ơn Admin đã cho tôi đăng bài  Đây là bánh hạnh nhân kiểu Ý/ Italian Almond cookies. Bánh này làm nhanh và  dễ nữa,ăn ngon lắm, mời mn Cách làm ở đây: "
3101513996634125,"Cảm ơn Admin đã cho tôi đăng bài  Đây là Xôi tôm khô Hà Tiên ăn chung với nước cốt dừa, món xôi này ăn ngon, làm nhanh, mời mn Sau đây là cách làm của tôi: "
3101240566661468,Hôm nay em làm món CHẢ LỤA GÀ( không cần gói lá).  Cách làm chi tiết ở đây ạ : 
3093170604135131,Chia sẽ vs mn công thức mình vừa học dc và dã thành công 
3088064067979118,"Cảm ơn Admin đã cho tôi đăng bài  Đây là Cơm gà rang bao bọc ngủ cốc cornflakes, ăn chung với nước sốt ngon lắm, mời mn Cách làm ở đây: "
3075052172613641,"Cảm ơn Admin đã cho tôi đăng bài  Đây là bánh bèo ngọt hai lớp quê tôi, ăn ngon lắm, mời mn Cách làm của tôi ở đây  "
3050628291722696,"Chào cả nhà, Ori xin chia sẻ cùng cả nhà món Xôi Mít rất dễ làm ạ. Cách làm cả nhà xem trong link này nhé ạ  Nguyên liệu bao gồm Mít gai 2kg Xôi 1 bát con Kem dừa Dừa nạo Cảm ơn Add duyệt bài ạ. Chúc cả nhà ngon miệng ạ"
3037156566403202,Bánh mì bơ tỏi VietNam Chia sẻ công thức :  Thành phần : - 7 bánh mì sandwich +  nướng trong 10 phút ở 150°C   ( 7 sandwiches  + bake for 10 minutes at 150 ° C ) - 50g bơ lạt  ( Butter ) - 15g rau mùi khô  ( Dried cilantro ) - 1 Thìa cà phê mật ong   ( 1 Tps Honey ) - 1/2 Thìa sốt mayonnaise   ( 1/2 Tps mayonnaise ) - 1/2 Thìa sữa đặc   ( 1/2 Tps condensed milk ) - 15g Tỏi   ( Gralic ) - 1g Muối  ( Salt ) - 1 trứng gà  ( Egg ) + Trộn tất cả các thành phần và phết một lớp lên bánh mì + Nướng ở 185°C trong 5 phút  ( Mix all ingredients and spread one layer on bread + Bake at 185 ° C for 5 minutes ) + Ăn kèm với một ít phô mai sẽ rất ngon  ( Served with a little cheese will be very delicious )++++++........ - Thank you for watching the video ...! - I wish you success and have 1 more delicious dishes for your menu ...! - Like Share and Subscribe the channel - Don't forget to leave a comment on what you like and I'll make a video ..!........  # ASMR  
3035167693268756,"Cà tím nướng mỡ hành. Cách làm của mình như trong video sau:  Nguyên liệu: 500gr Cà Tím   Hành lá Hành tím Ớt, tỏi, dầu ăn, nước mắm, đường  Đậu phộng Danh sách các món nướng ngon: "
3034318940020298,"Đào vào mùa nên rất rẻ, làm 1 ít đào ngâm ăn dần ạ "
3012985208820338,Mình xin chia sẻ cách làm Chè trôi nước mình đã làm thử và thành công. Link cách làm của mình   400gr Bột nếp 100gr Đậu xanh 50gr Khoai lang Đường gừng lá dứa mè bột cốt dừa Danh sách các video để làm món ngon: 
3007446182707574,"Nha đam đường phèn Nhà trồng được ít nha đam mình sẽ nấu nước uống cho mát, đẹp da nhé: Nguyên liệu: 1. Nha đam 2. Lá dứa 3. Đường phèn  Cách làm chi tiết như mình soạn video:  Danh sách các video để làm món ngon: "
3001911853261007,Lần đầu mua được ốc nhảy tươi rất tươi. Lể ra ăn mà nguyên con dài không bị cát  Tươi như vậy hấp ăn chấm muối ớt thôi là ngon rồi nhé 1kg ốc nhảy  Ít ớt Ít chanh Ít muối sống/hạt
2987697504682442,CÁCH NẤU SỮA BẮP KINH DOANH Nguyên liệu : 3 quả bắp 120 -150 gram đường phèn 100ml sữa đặc 1 gói sữa tươi 220ml 2 cộng lá dứa Video cách làm nha cả nhà. 
2969596769825849,Cách làm kem bơ Keto giảm cân | Keto DessertThành phần chỉ 3 nguyên liệu luôn:  Cảm ơn ad đã duyệt bài nha!!!
2959767274142132,
2952822024836657,"E tặng đặc biệt cho Team ghiền  như êm ạ   Kem sầu cứng như đá mà cắn phát nó xốp mềm lém ạ, thơm, nhai rộp rộp sướng miệng ghê hê...hê, mà còn bếu dã man con ngan há....há   Không như kem mua ngoài chỉ có hương sầu, không nó thỏa cơn ghiền đc đâu ạ, anh/chị/em và các bạn thử ct của êm đi nhoa, êm đảm bảo không hối hận xíu nào   Link chi tiết full HD không che ở đây ạ, đừng quên subcribe ủng hộ e ra video hay nhé   "
2949895695129290,"Cảm ơn admin ạ  Quẩyyy thôiiii , mời cả nhà quẩy xoắn thừng  công thức siêu giòn nạ : Nguyên liệu:  Phần bánh quẩy gồm có : - bột mì 300g-protein 8% - Men nở 5g  - Trứng 1 quả - Muối ăn 1 nhúm nhỏ - Dầu ăn 40 g - Nước: 100 ml Phần ngào đường gồm có : - nước 60 ml - đường 100g Xem ngay công thức làm chi tiết nhaaa : "
2935851826533677,"Nước Uống Keto Chỉ 2 Thành Phần | Cacao và Whipping Cream | Homemade LOW CARB Hot Cocoa For KETO  This keto hot cocoa recipe is the most amazing hot chocolate recipe you will ever have! Plus its a dairy free keto recipes. This keto drink recipe is a hot chocolate with cream. You can substitute with any dairy free milk though.  KETO HOT CHOCOLATE RECIPE (serves 4) ¼ cup heavy whipping cream or coconut cream (60 ml/ 2 fl oz) 57 g unsweetened chocolate/ raw cacao paste (2 oz) Note: Instead of unsweetened chocolate, you can use 85%-90% dark chocolate and skip the sweetener. You can watch this video to know recipes: "
2935171649935028,Hôm nay mình vô tình đọc được cách làm món bánh chay khá hay nên chia sẻ với mọi người. Giành cho nhưng bạn nào đang muốn làm bánh chay nhưng không biết tìm công thức làm bánh ở đâu.
2910833695702157,"Bánh mỳ nướng bơ tỏi ko cần lò đây? Chỉ với 3 nguyên liệu đơn giản: bánh mỳ, bơ, tỏi là bạn đã có 1 món ăn vặt ngon, thơm và giòn nhé! Các bạn có thể xem video này để biết cách làm nha: "
2896938660424994,"chưa biết cách làm thì bơi vào đây nha, hihi Công thức cực kỳ đơn giản với các nguyên liệu như: bánh tráng, trứng gà, xúc xích, phô mai là đã có thể tự làm món bánh tráng nướng siêu ngon tại nhà luôn. Các bạn có thể xem cách làm tại đây: "
2868978996554294,"Ngày nóng bức mà tự làm được  một ly trà sữa, không phải ra quán mới được thưởng thức, nó cũng thú vị ra trò. Nhà làm, tất nhiên không thể chuyên nghiệp được như quán nhưng điều mà mình an tâm nhất đó là mình biết mình cho cái gì vào, tự tay mình làm cho chính những người thân yêu của mình. Giản dị vậy thôi. "
2862628253856035,"Nấu nước dùng gà trong vắt thơm ngon, không cần bột ngọt, bột canh, bột nêm để sẵn , tiện lợi cho các bạn khi cần lấy ra để nấu bún , cháo , canh,...Bấm vô link này nhé:  "
2850752681710259,"Ngon ngất ngây với món bề bề hấp sả ! Chỉ với 15 phút có ngay món bề bề hấp bia sả thơm ngon tuyệt vời - Nguyên liệu gồm: Bề bề, sả và 1 đến 2 lon bia. Để món bề bề thêm ngon và đậm đà hơn chúng ta cần thêm ít gia vị như gừng, muối, mì chính, tiêu bắc... - Cách làm: Đầu tiên chúng ta cần ướp bề bề với các gia vị như gừng, muối, mì chính, tiêu bắc,... tùy khẩu vị mỗi người, nếu các bạn ăn được cay thì có thể cho thêm ớt vào. Ướp khoảng 2-5 phút. Sả sau khi rửa sạch chúng ta đập dập ra cho nó thơm sau đó rải đều sả vào nồi, rồi đổ bia vào Tiếp theo cho bề bề vào nồi xếp sao cho đều và khít nhất, tránh để dồn đống sẽ bị ra hết chất ngọt của bề bề. Rồi bật bếp lên đun khoảng 10-15 phút khi vỏ bề bề ngả màu vàng thì lúc đó bề bề đã vừa chín tới, Lúc này gấp ra ăn luôn thì thơm ngon tuyệt vời (Không nên đun quá lâu vì sẽ mất hết chất dinh dưỡng, chất ngọt của bề bề). Lưu ý: Món này bạn chỉ cần chấm với muối tiêu chanh là ngon tuyệt cú mèo rồi. Chúc các bạn thành công với món Bề bề hấp bia sả này nhé. ——————– Cửa hàng Hải Sản Quất Lâm hân hạnh được phục vụ quý khách. Chúng tôi luôn có sẵn Hải sản tươi sống, có đội ngũ nhân viên tần tình. Quý khách có thể đặt hàng Ship tận nhà và thanh toán sau khi nhận hàng tại khu vực Hà Nội. Để đặt hàng quý khách vui lòng liên hệ hotline: 08888.77.808 Hoặc nhắn tin Zalo: 08888.77.808 Liên hệ Facebook: Hải Sản Ngon Bổ Rẻ Ship Tận Nơi (  ) Địa chỉ: 102 Phố Sài Đồng – Quận Long Biên – TP. Hà Nội Chúng tôi xin chân thành cảm ơn quý khách hàng! ——————– 1000 CÔNG THỨC NẤU ĂN NGON xds"
2850703825048478,Chả Ốc nướng ống tre và Chả Ốc nướng lá chuối đi mọi người ơi 
2846705735448287,Chè Sắn Hà Nội. Món này ăn nóng nhà cả nhà. 
2827342977384563, Rau câu trái dừa tứ vị mời cả nhà nhen. Đang ở ẩn có gì làm đó trước nha cả nhà. Cuối tuần vui vẻ nha cả nhà
2813929668725894,Sữa Chua trân châu  Chúc cả nhà cuối tuần cui vẻ 
2835506216568239,"Không có cua đồng, nên mình xài cua biển vậy chứ biết sao giờ  Bún riêu cua biển, tưởng không ngon mà ngon không tưởng bà con ơi! Xin phép admin cho em add cái link cho bạn nào muốn tìm hiểu ạ!  "
2996801733772019,Tự làm bánh pizza  ở nhà cực kỳ đơn giản luôn:  Nguyên liệu chính: 1. Đế pizza  mua ở siêu thị size to 6 cái khoảng 60k 2. Phô mai emmental bào sẵn. Mua loại dùng cho pizza sẽ kéo sợi được 3. Tương cà cholimex 4. Nguyên liệu yêu thích 
3331504126968443,"Hơn 2 tháng qua e đã chia sẻ gián tiếp cho 302 người khó khăn.m ko những giúp các bn bài viết này m còn có khả năng giúp những ae bếp đang thất nghiệp có 1 công việc ổn định hơn và có 1 vị trí vững chắc nhất có thể.cho đến bây giờ e rất vui khi được tham gia nhóm để biết đến mọi người nhiều hơn .hnay e viết bài này rất mong cám ơn các bác đã tin tưởng e trong thời gian qua. Sau đây e chia sẻ các công thức liên quan đến những ng đang khó khăn vì phải mua công thức.. ***Vịt quay vân đình 8 năm về trước: Gừng 500g,xả 700g,riềng say 1 túi,hành khô 500g,ớt cay 10 quả,ngũ vị hương 3 gói,tỏi 5 lạng,tất cả cho vào máy xay giò xay nhuyễn.... Dấm trắng 3lit,nước mắm 3 lít,nước lọc 3 lít,2kg đường vàng,1 bát ăn cơm mỳ chính đảo đều cho tất cả nguyên liệu đã xay trc đó đảo đều ướp vịt.. Cách làm:vịt mổ phanh đập bẹp các mặt lưng,xương vai và đùi nhớ đập bẹp thêm tý nữa nhé..1 con vịt cho vào xô hay chậu tùy,múc 1 muôi xào to dội lên mặt bụng vịt,tiếp đó thêm con thứ 2 lại thêm 1 muôi nước ướp vào cứ thế đè lên nhau(dùng xô đựng sơn sẽ hợp hơn.. ****vịt quay vân đình hiện tại e làm ở nhà hàng. Gia vị giành cho 10 con...gồm hành củ khô 300g,xả 100g,giềng say 250g,lá móc mật 2 lạng say nhuyễn ra rồi cho gia  vị đảo đều.. Mì chính 100g,tiêu bắc xay 1 thìa,dầu mè 2 thìa ,ngũ vị hương 4 gói,1 chai dầu hào kim tiêu  bóp đều gia vị cùng với nguyên liệu đã xay thoa đều lên 2 mặt vịt đã đập sẵn... Cách lên màu vân đình đơn giản..m nướng chủ yếu dùng nhiệt để lấy màu hoặc 1 bát con ăn cơm,3 thìa ăn cơm dấm,nửa thìa mật ong đảo đều dùng chổi quyét sơn quyét khi vịt đã khô và có độ nóng...  ***nước chấm 2 loại: 1,5kg tỏi say,4 lạng tương ớt,5 lạng nước cốt chanh,700g đường vàng,5l xì dầu quê tôi.. tất cả say nhuyễn bằng may say sinh tố..xả 4 cây đập bẹp phi thơm cùng với 1 muôi lẩu dầu mè,100 g lá móc mật phi vàng đổ thẳng vào gia vị m say trc đó.. Nước chấm 2..1 thùng nước tương tam thái tử,1,4kg đường,1 bát cơm tương ớt,2kg nước lọc đun sôi sau đó pha 3 lạng bột năng hoà với 1l nước trắng hoà tan với nhau chờ nước tương trong nồi sôi  dội từ từ là được..còn các bn muốn cho gì tạo độ thơm thì tùy nhé.m thì tỏi băm nhuyễn để sẵn ngoài ai ăn thì cho vào...kakakka.. ***Vịt quay lạng sơn: Gừng 150g,mắc mật khô 200g,tỏi 100g,đậu phụ thối 9 miếng,muối tinh 40g,đường vàng 50g,ngũ vị hương 2 gói,đạm tương 250g,hạt nêm 50g,bột canh 50g,kỳ tử hương 1 thìa canh,xì dầu 2 muỗng canh,dầu hào 2 muỗng canh,cốt dừa 2 thìa... **cách tắm vịt quay.  Bước 1:4l nước trắng,1bát dấm trắng đun sôi nhiệt độ 60 độ,dội qua khoảng 10giây . Bước 2:4l nước ,70ml mật ong,100ml mạch nha,4 thìa cafe muối chanh,2 bát dấm.đun sôi 70 độ tắm đi tắm lại 3 lần hong khô bật quạt 3 tiếng.. Nhiệt độ 250 đến 300...35 đến 40 phút...đậy kín lò thêm 5p nữa lấy vịt ra.. C**.cách hãm tiết canh và đánh tiết canh bằng nước sôi.. 1 gói ozon 450 ,nửa bát con ăn cơm nước lọc hoà tan cắt tiết 5,đến 6 con... Cách đánh tiết canh bằng nước sôi hoặc nước dùng sôi...hiện tại m đánh bằng nước dùng sôi ở nhiệt độ 50 độ tránh váng mỡ lấy nước trong..trc khi đánh m lắc lên lắc xuốngchai tiết 3 đến 4 lần vì có tác dụng làm đều tiết và tạo màu cho tiết..lắc xong để bàn tầm 1,2 phút nó giảm bọt..tỉ lệ 1,1 nhé..hoặc nước 1,tiết thêm hơn 1 tý cũng ko sao...lưu ý đánh bằng nước dùng sôi ko cho rau thơm chỉ cho hành nướng băm,muốn ngon hơn nữa kết hợp giữa cuống họng lợn luộc với mề vịt ,m ko cho gan vào...lòng vịt bạn luộc chín cắt vừa nhỏ đặt chảo lên bếp cho chảo nongs lên,cho 1 thìa ăn cơm dầu ăn xào khi nào lòng vịt ngã màu vàng là được nhé.....nốt nhà hàng này mình ko còn đi dạy cho ai nữa ,m rất buồn khi bị ngta xích chân lại ko cho tung hoành nữa..kính mong ae trong hội đừng cãi nhau vì mấy cái chuyện vớ vẩn..cùng nhau phát triển.mình tạm thời ẩn mình 1 thời gian để chuẩn bị cho cơ sở 6 mọc lên tại hải phòng.các bác đọc được mong đừng chửi e. .........Coppi"
2796022983849896, Cách làm tàu phớ hay còn gọi là tàu hủ trân châu nước đường nha cả nhà.  Chúc cả nhà buổi tối vui vẻ.
2791019904350204,Ai muốn làm món cơm chiên này tại nhà không ạ nếu muốn biết rõ món này cần những gia vị gì xin hãy nhập vào đây ạ 
2793883990730462,Ai muốn làm mỳ ý sốt cà chua thịt bầm không ạ 
