"MแบธO CHแปฎA BแปNH TRONG CUแปC SแปNG Cร LรC BแบN CแบฆN 1. Lแบนo mแบฏt, ฤลฉa cแบฃ thฦฐแปng dรนng ฤรกnh cฦกm/ hฦก nรณng แบฅn vรo chแป lแบนo vรi lแบงn khแปi ngay 2. ฤi mฦฐa lแบกnh , nแปi dแป แปฉng mแป ฤay/ Lแบฅy quแบงn รกo khรด, hฦก nรณng ta ฤem mแบทc vรo. 3. Bแป con ong ฤแปt dรนng lรก Tรญa tรด/ bรณp nรกt lแบฅy nฦฐแปc, ta ฤem rแปt vรo 4. Chแบณng may rแบฟt cแบฏn ฤรฃ cรณ lรก แปt/ ฤem giรฃ lแบฅy nฦฐแปc bรดi cho mau lรnh 5. Rแบฏn ฤแปc cแบฏn, cแบฅp cแปฉu bรดi nhแปฑa ฤu ฤแปง xanh/ rรนi quแบฃ thรกi nhแป, sแบฏc uแปng, ta ฤem uแปng liแปn 6. Trแบป con hay khรณc dแบก ฤแป, ฤรฃ cรณ xรกc Ve sแบงu ฤแปซng lo/ Sao vรng, tรกn bแปt, uแปng cรนng nฦฐแปc Cฦกm 7.Nแบฟu bแป dแป แปฉng mแป ฤay ฤรฃ cรณ lรก ฤinh lฤng/ Kinh giแปi, Tรญa tรด, rau Mรก, Diแบฟp cรก trแปn vรo mร ฤun 8. Trแบป em lรชn quai bแป, hoแบทc muแปi , cรดn trรนng ฤแปt/ Lแบฅy hแบกt Gแบฅc nฦฐแปng chรญn, ngรขm giแบฅm hoแบทc mร bรดi 9. Muแปn trแป sแปt vi rรบt mรนa Hแบก/ Kinh giแปi, Diแบฟp cรก, ฤun lรชn uแปng liแปn 10.Trong ฤแปi trแบป em, khรดng trรกnh ฤฦฐแปฃc cรณ lแบงn bแป Kiแบฟt lแปต/ Cแป sแปฏa ฤun nฦฐแปc uแปng, vรi ngรy cแบงm ngay 11. Muแปn trแป Bแบกch ฤiแบฟn (lang ben)/ Riแปng tฦฐฦกi, hay Phรก cแป chแป ngรขm rฦฐแปฃu mร bรดi 12. Muแปn cho thแบฃi ฤแปc mแบกnh trong gan/ Phan tแบฃ diแปp sแบฏc uแปng cho sแป hแบฟt ฤแปc ra 13. Muแปn cho hแบฟt bแปnh vรng da/ Nhรขn trแบงn sแบฏc uแปng thay trร sแปm khuya 14. Trแปi lแบกnh trรบng giรณ mรฉo mแปm/ ฤแป lรขu khรณ trแป, Kinh giแปi uแปng liแปn 15. Muแปn cho miแปng hแบฟt hรดi/ sรบc miแปng nฦฐแปc lรก แปi, ta ฤun ฤแบทc vรo 16. Khi sรขu rฤng mร chฦฐa hฦฐ tแปงy/ rฦฐแปฃu hแบกt Cau ta ฤem sรบc miแปng 17. Muแปn cho thแบญn khแปe, rฤng chแบฏc/ Cแบฉu tรญch, ta ฤun nฦฐแปc uแปng hแบฑng ngรy 18. Muแปn cho mแปฅn nhแปt, mแบฉn ngแปฉa hแบฟt mau/ Lรก ฤinh lฤng ฤem sแบฏc, nฦฐแปc uแปng hแบฑng ngรy 19. Muแปn bร mแบน khรดng sแปฏa tแบฏc/ Mแปc thรดng hoแบทc lรก Mรญt, lรก ฤinh lฤng ฤun nฦฐแปc uแปng 20. Lแบกi muแปn ngแปซng ra sแปฏa/ lรก Dรขu tฦฐฦกi ฤun nฦฐแปc uแปng 21. Muแปn cho hแบฟt tรกo bรณn, sแปฏa Bรฒ tฦฐฦกi uแปng thแบญt nhiแปu/ Hoแบทc rau Dแปn ฤแป, Diแบฟp cรก, rau ฤay, Mรนng tฦกi nแบฅu canh ฤn 22. Muแปn cho hแบฟt tiรชu chแบฃy, ฤรฃ cรณ lรก แปi, Hแปng xiรชm xanh/ Hoแบทc vแป quแบฃ Mฤng cแปฅt, ta ฤem ฤun nฦฐแปc uแปng 23. Muแปn cho sรกng mแบฏt, mรกt gan/ trร hoa Cรบc cรนng ฤem ra ฤรฃi bแบกn 24. Muแปn cho รกp huyแบฟt lรชn cao/ trร Gแปซng vรi cแปc lแบกi tฤng lรชn liแปn 25. Muแปn cho รกp huyแบฟt xuแปng thแบฅp/ trร hoa ฤแบกi vรi bรดng xuแปng liแปn 26. Muแปn trแบป em hแบฟt rรดm sแบฃy/ nฦฐแปc Dแปซa tฦฐฦกi uแปng vรo rแบฅt ngon 27. Muแปn trแบป lรขu, ฤแบนp da/ ta dรนng nhiแปu Kแปท tแปญ 28. Muแปn chรณng bรฉo, ฤแปก gแบงy/ ta uแปng nhiแปu sแปฏa Ngรด 29. Muแปn giแบฃm cรขn, tiรชu mแปก/ Tรกo mรจo, vแป Bฦฐแปi, sแบฏc uแปng tแบกo niแปm vui 30. Muแปn cho chรขn ฤฦฐแปฃc khแปe/ Ngลฉ gia bรฌ sแบฏc uแปng 31. Muแปn cho khแปi ฤแบกi trรng/ ta ฤn nhiแปu lรก Mฦก 32. Muแปn cho khแปi ฤau dแบก dรy/ vแป trแปฉng Gร sแบฅy khรด, nghiแปn bแปt, ta ฤem uแปng 33. Muแปn cho khแปi quรกng gร, khรด mแบฏt/ ฤn Bรญ ฤแป hแบฑng ngรy, chแป quรชn 34. Muแปn cho bแปฅng ฤแปก lแบกnh/ cแปง Riแปng ฤun nฦฐแปc uแปng 35. Muแปn cho bแปฅng ฤฦฐแปฃc mรกt/ ta uแปng bแปt Sแบฏn dรขy 36. Muแปn cho phแบงn ngแปฑc ฤฦฐแปฃc แบฅm/ ta ฤem uแปng Gแปซng tฦฐฦกi 37. Muแปn cho phแบงn ngแปฑc mรกt/ hแบกt cรขy Mรฃ ฤแป sแบฏc uแปng 38. Muแปn cho khแปi ฤรกi ฤแปฅ/ rแป cแป Tranh sao vรng sแบฏc uแปng 39. Muแปn cho ฤฦฐแปฃc ngแปง tแปt/ Lแบกc tiรชn ฤun nฦฐแปc uแปng 40. Muแปn cho da mแบทt trแบฏng mแปn/ lรก Dรขu, Vแปซng ฤen, ฤun nฦฐแปc vแปi mแบญt Ong 41. Muแปn cho khแปi bแปnh trฤฉ/ hoa Thiรชn lรฝ ฤn hแบฑng ngรy 42. Nแบฟu ta tiรชu hรณa kรฉm/ cแปง Sแบฃ ฤun nฦฐแปc uแปng 43. Bแป ho, ฤแปm nhiแปu ฤแบฟn khแป/ vแป Quรฝt ฤun nฦฐแปc uแปng 44. miแปng nรดn, trรดn thรกo, thแบญt lร sแปฃ ghรช/ Hoแบฏc hฦฐฦกng, vแป Quรฝt, ta ฤun uแปng liแปn 45. thแปi tiแบฟt thay ฤแปi khรn tiแบฟng, mแบฅt giแปng/ vแป Quรฝt ฤun nฦฐแปc uแปng thแบฅy hay liแปn 45. Chanh leo ฤแปซng bแป hแบกt ฤi/ ฤรณ lร thแบงn dฦฐแปฃc phรฒng ngแปซa ung thฦฐ 46. hรณc xฦฐฦกng nhแป, niแปm cรขu thแบงn chรบ/ โgแบงn thรฌ ra, xa thรฌ vรoโ cho hแปng dรฃn, xฦฐฦกng trรดi ra 46. ฤi ฤรกm tang, bแปc mแป chแป quรชn/ dรนng Gแปซng, Tแปi, chแปng khรญ hรn, ma nhแบญp 47. Cam tแบฉu mรฃ, khรดng cรณ gรฌ ฤรกng sแปฃ/ Cรณc cแบฃ con, nฦฐแปng chรกy, nghiแปn bแปt rแบฏc vรo 48. mแป hรดi trแปm trแบป con hay mแบฏc/ lรก Dรขu buแปi sแปm hรกi vแป mร ฤun 49. mแป hรดi chรขn tay xin ฤแปซng quรชn lรก Lแปt/ vแปซa uแปng, vแปซa ngรขm cลฉng giแบฃm ฤi 50. trแปi quรก lแบกnh รกp huyแบฟt lแบกi vแปt lรชn cao/ ngรขm chรขn nฦฐแปc Gแปซng, Muแปi ฤฦฐa hฦฐ hแปa vแป 51. mแบทt tรกi mรฉt, mรดi thรขm, rรฉt run do lแบกnh/ giรฃ cแปง Gแปซng tฦฐฦกi, uแปng แบฅm รกp cแบฃ ngฦฐแปi 52. vแป Bฦฐแปi sao vรng, ฤun nฦฐแปc uแปng/ gan nhiแปm mแปก, bรฉo bแปฅng dรนng rแบฅt hay 53. trong dแบก dรy cรณ con vi khuแบฉn Hp/ ฤแปซng quรชn uแปng cแบกn trร Dรขy 54. lแบกi hay bแป ฤau lฦฐng/ ฤแปซng quรชn cแปง Cแบฉu tรญch 55. hay bแป ฤau xฦฐฦกng khแปp/ ฤรฃ cรณ dรขy ฤau xฦฐฦกng 56. ฤau vai gรกy, khรดng quรชn cรnh Dรขu/ sao vรng, hแบก thแป mร ฤun nฦฐแปc uแปng 57. rau Dแปn, rau Mรก, Cแบฃi xoong/ lร nhแปฏng mรณn bแป mรกu 58. Nhรขn sรขm, cแปง ฤinh lฤng/ dรนng vรo bแป khรญ, thรชm sแปฉc lแปฑc 59. bรญ trung tiแปn thรฌ cรณ hแบกt Mรญt/ luแปc lรชn mร ฤn, ฤแบฃm bแบฃo thรดng liแปn 60. bรญ ฤแบกi, tiแปu tiแปn ฤรฃ cรณ Phรจn chua/ ฤem nung lรชn, tรกn bแปt, rแบฏc lรชn rแปn 61. muแปn giแบฃm ฤi tiแปu nhiแปu/ nแบฅu chรกo cแปง Sรบng mร ฤn 62. lแบกi muแปn ฤi tiแปu nhiแปu/ nรชn ฤn ฤแปu rau Cแบฃi 63. nแบฟu bแป chแปฉng giแปi leo/ nhแปฑa cแป Sแปฏa ฤแปซng quรชn bรดi vรo 64. trแบป em lฦฐแปกi giแปng bแบฃn ฤแป/ Cร tรญm cรด nฦฐแปc thแบญt ฤแบทc, lแบฅy bรดng thแบฅm vรo 65. tฦฐa lฦฐแปกi thรฌ cรณ lรก rau Ngรณt/ giรฃ lแบฅy nฦฐแปc bรดi vรo chแป tฦฐa 66. muแปn ra nhiแปu mแป hรดi/ ฤแปซng quรชn cแปง Khรบc khแบฏc 67. bแป nhแปn ฤรณi ฤรฃ lรขu/ chแป nรชn ฤn chรกo loรฃng 68. bแป ngแป ฤแปc thแปฉc ฤn/ cลฉng nรชn tแบกm dแปซng ฤn 69. bแป ฤแปa chui vรo ngฦฐแปi/ ฤรฃ cรณ mแบญt Ong ฤแบทc trแป 70. mแบญt Ong โฆ dฦฐแปi 12 thรกng tuแปi/ chแบณng nรชn cho trแบป dรนng 71. suy dinh dฦฐแปกng trแบป nhแป/ Cao ban long lร thแบงn dฦฐแปฃc 72. bแป vแบฟt thฦฐฦกng nhแป, chแบฃy mรกu/ giแบฅy ฤแปt lแบฅy tro rแปt vรo cแบงm mรกu 73. muแปn mรกu nรฃo lฦฐu thรดng/ khรดng quรชn mรณn Ngแบฃi cแปฉu 74. muแปn cho ngฦฐแปi ฤแปก sแปt/ Diแบฟp cรก bแบกn ฤแปซng quรชn 75. hoa Mรo gร trแบฏng giรบp cแบงm mรกu tแปญ cung/ sao chรกy ฤen ฤun nฦฐแปc uแปng 76. ฤแป tiรชu sแปi gan, mแบญt/ ฤแปซng quรชn cแปง Nghแป vรng 77. ฤแป tiรชu ฤi sแปi thแบญn/ trรกi Dแปฉa (Thฦกm) nฦฐแปng ฤn 78. bแปnh gout cแบงn phแบฃi phรฒng ngแปซa/ ฤแป xanh cแบฃ vแป, ta ฤn cho nhiแปu 79. trแบป ho ฤรฃ cรณ lรก Hแบน tฦฐฦกi/ hแบฅp vแปi ฤฦฐแปng phรจn khแปi cแบงn khรกng sinh 80. ฤau mแบฏt ฤแป cรณ lรก cรขy Diแบฟp cรก/ ta ฤem giรฃ nhuyแปn rรนi ฤem ฤแบฏp vรo 81. viรชm hแปng ฤรฃ cรณ quแบฃ Trรกm ฤen/ bแป hแบกt, ninh nhแปซ, thรชm ฤฦฐแปng uแปng cho ngon 82. bong gรขn ฤรฃ cรณ lรก cรขy hoa Lรกng trแบฏng/ nฦฐแปng nรณng, giรฃ nhuyแปn, ta ฤem ฤแบฏp vรo 83. chแบณng may bแปng lแปญa, nฦฐแปc sรดi/ lรก Bแปng giรฃ nhuyแปn, ฤแบฏp vรo vแบฟt thฦฐฦกng 84. chแปc ฤแบงu, ghแบป lแป, mแป hรดi trแปm แป trแบป nhแป/ lรก Bแปng vแบฏt nฦฐแปc, uแปng vรo thแบญt hay 85. bแป kiแบฟt lแปต cลฉng thแบญt lร khแป ghรช/ rau Sam ฤun nฦฐแปc uแปng, thรชm ฤฦฐแปng cho ngon 86. ฤแป phรฒng ngแปซa nguy cฦก xฦก vแปฏa ฤแปng mแบกch/ rau Sam, Gแปซng sแปng, ฤun lรชn mร dรนng 87. viรชm loรฉt dแบก dรy cรณ Bแบฏp cแบฃi rแบฅt hay/ trแบงn qua, vแบฏt nฦฐแปc, ta ฤem uแปng liแปn 88. trรชn ฤฦฐแปng ฤi xa, viรชm loรฉt dแบก dรy chฦฐa cรณ thuแปc/ xin cแปc bแปt Sแบฏn dรขy uแปng ngay ฤแป tแบกm hรn vแบฟt loรฉt 89. chแบณng may bแป bแปng แปt/ lรก แปt giรฃ nรกt ta ฤem ฤแบฏp vรo 90.ฤi ngoรi ra cแบฃ mรกu tฦฐฦกi/ Hoa hรฒe sao chรกy, ta ฤun nรชn dรนng 91. Mรกu nรณng quรก bแปฉc ra ฤแบฑng mลฉi ( mรกu cam)/ Cแป nhแป nแปi mรกt mรกu ฤun nรชn mร dรนng 92.Dแบก dรy xuแบฅt huyแบฟt, cแบงn cแปฉu ngay/ Cแปง Bแบกch cแบญp nฦฐแปng chรกy mร dรนng cแปฑc hay 93. ฤแปซng dแบกi mร nghแปch nhแปฑa xฦฐฦกng rแปng/ Nรณ cรณ chแบฅt ฤแปc cรณ ngรy loรฉt da 94.Nแบฟu sแปt xuแบฅt huyแบฟt, mแปi mแบฏc/ Diแบฟp cรก, cแป nhแป nแปi kแบฟt hแปฃp cรนng nhau 95. Trแปi lแบกnh, huyแบฟt รกp lรชn cao ฤแปt ngแปt/ Ngรขm chรขn nฦฐแปc แบฅm, hแบก liแปn รกp ฦกi 96.Trแปi mฦฐa lแบกnh ฤรขu nhแปฉc khแปp xฦฐฦกng/ Cรขy lรก lแปt sao vรng ,vแปซa ngรขm vแปซa uแปng 97. Mรนa ฤรดng lแบกnh khรดng sao ngแปง ฤฦฐแปฃc/ Cแปง gแปซng nฦฐแปng chรกy, rรนi ฤun uแปng liแปn 98. Trแปi lแบกnh bแป chแปฉng ฤau nแปญa ฤแบงu/ Gแปi ฤแบงu nฦฐแปc Quแบฟ thแบฟ lร hแบฟt ฤau 99. Quแบฃ dรขu ta chรญn, thแบญt hay/ Dรนng nhiแปu bแป huyแบฟt, sรกng mแบฏt , tรณc lแบกi thรชm ฤen. 100. Nฦฐแปc bแปt , lร thแปฉ nฦฐแปc โ Cam lแปโ/ Nuแปt แปฑc xuแปng bแปฅng,tiรชu tan bแปnh mร."
"Bแปฏa sรกng mร ฤn xรดi thรฌ hแบฅp dแบซn nhแบฅt luรดn nรจ, cรกc mแบน nแปi trแปฃ bแป tรบi lแบกi cho bแปฏa sรกng gia ฤรฌnh bแบกn nhรฉ <3Hฦกn 50++ cรกc mรณn xรดi hแบฅp dแบซn, xem thรชm tแบกi:https://www.cooky.vn/bo-suu-tap/go/c401539"
"Ngon xuรฝt xoa tรด BรNH ฤA Cร Rร ฤแปNG ฤแบญm ฤร khรณ quรชn ORDER TแบI ฤรY: https://bit.ly/2M3HwOKBiแบฟn tแบฅu mแปi lแบก bรกnh ฤa cรก rรด ฤแปng nรy ฤรฃ ai thแปญ qua chฦฐa nรจ! Mแปt tรด ฤแบงy ฤแบทn, nรณng hแปi, nฦฐแปc dรนng ngแปt thanh, ฤn kรจm vแปi rau sแปng bao ngon. Order liแปn tแบกi LixiApp vแปi ฦฐu ฤรฃi hแบฅp dแบซn giแบฃm ฤแบฟn 40% ฤรณ!"
"Chแบฅt cแปก nรy sao cฦฐแปกng nแปi Mร VแปT TIแปM 35K bรกn duy nhแบฅt 1 ngรy trong tuแบงnXem ฤแปa chแป: http://bit.ly/2JvSbA3Hแบฅp dแบซn cแปก nรy mร hแปng ฤn cรณ lแปi vแปi bao tแปญ lแบฏm nghen ๐ ๐ ๐ Chรบ รฝ cรด chแป bรกn mรณn nรy duy nhแบฅt 1 ngรy trong tuแบงn thรดi nha, mแบฅy ngรy kia cรด bรกn mรณn khรกc, nรชn bแบกn nรo muแปn ฤi ฤn thรฌ canh me cho ฤรบng ngรy nรจ <3"
"แปฆNG Hแป PHร LแบคU Bร NGOแบI 83 TUแปI nแบฅu tแปซ dแปซa xiรชm ๐ฒ Download App xem Review-> https://li-xi.app.link/kKHYqbY3xY๐ฃฤแปa chแป+Review: http://bit.ly/2LtOBIRฤn ฤรขu cลฉng dแบญy ฤn dรนm ngoแบกi, ngoแบกi cรกm ฦกn ๐ฅฐ Ngoแบกi nแบฅu phรก lแบฅu hฦกn 30 nฤm rแปi nรชn chรฉn phรก lแบฅu thฦกm ngon hแบฟt nรณi luรดn he ๐#lixibook #reviewcotam #trv #ddauSG #ddau #SaiGon"
"Bแบกn thuแปc Team yรชu bรกnh nฦฐแปng sฦฐฦกng sฦฐฦกng hay Team thรญch bรกnh rau cรขu ฤแป ฤn cho mau ๐๐"
"ฤn say sฦฐa BUFFET NฦฏแปNG King BBQ Hรn Quแปc chแบฅt chฦกi chแป 200kk/ngฦฐแปi <3 Tแบทng ngay 50k uแปng The Coffee House  Chแป รกp dแปฅng khi mua TแบI ฤรY: https://bit.ly/2GD36XsBแป nรo muแปn ฤn thแปt nฦฐแปng thรฌ ghรฉ King BBQ lร sแป dzรกch ฤรณ nghen. Chแป 200k/ngฦฐแปi ฤn say sฦฐa, thแปa sแปฉc check in luรดn hen ๐๐ ฤรฃ vแบญy cรฒn ฤฦฐแปฃc tแบทng thรชm 50k uแปng The Coffee House khi mua 2 cash voucher tแบกi LixiApp nแปฏa nรจ. Ta nรณi vแปซa xแปn vแปซa rแบป hแปng mua tiแบฟc hรนi hแปฅi cho coi nha <3"
"Mแบน hay la hoรi mร cรกi tแบญt mรช troai lรm sao bแป mแปi ngฦฐแปi ฦกi ๐คฃ๐คฃ"
"Fan mรฌ gรณi ฤรขu rแปi!!! Triแปn ngay cรดng thแปฉc lรm Mร TRแปN BแบฎP Bร CAY siรชu phแบฉm nรy nhรฉ. ฤแบฃm bแบฃo ngon bรก chรกy, ฤn lร ghiแปn ๐"
"CรC BAO Tแปฌ vร nhแปฏng mรณn ngon khรดng thแป bแป lแปก cแปงa chแป em mรฌnh nhแปฏng ngรy thรจm chua. Cแบฏn 1 phรกt lร thแบฅy giรฒn rแปฅm, cแบฏn phรกt nแปฏa lร chua tรช tรกi, ngon quรกaaa ๐๐"
"Mรณn ฤn ฤแบทc sแบฃn quรช hฦฐฦกng cแปงa mแปi ngฦฐแปi hay lรm cho cแบฃ nhร lร mรณn gรฌ vแบญy ta, chia sแบป cho ad vแปi ๐คค๐คค๐คค"
"Hiแบฟm cรณ khรณ tรฌm BรNH NGรN LแปP ngแปt thฦกm hฦฐฦกng vแป cแปงa tuแปi thฦก <3๐ฃฤแปa chแป+Review: https://app.lixibook.vn/UcmA7FprLแปn rแปi vแบซn nhแป mรฃi hฦฐฦกng vแป nรy, vแป bรกnh giรฒn, nhรขn thฦกm bรฉo khรดng gแบฏt, bรณc, lแปงm, hแบฟt cรกi bรกnh! ๐คฃ#lixibook #reviewcotam #trv #ddauSG #ddau #SaiGon"
"Bฦก lรบc khรดng chรญn thรฌ thรดi, lรบc chรญn thรฌ chรญn hแบฟt mแปt lแบงn ๐๐ Cรณ mแบนo BแบขO QUแบขN Bฦ nรy rแปi thรฌ ฤแป cแบฃ tuแบงn mร bฦก vแบซn khรดng bแป thรบi nhรฉ cรกc chแป  ฦกi. Lฦฐu lแบกi ngay thรดi, hแปฏu รญch lแบฏm แบก๐"
"Hรng nแปi ฤแปa Trung Quแปc ฤแปnh vแบญy? :)Xem xong nuแปt nฦฐแปc bแปt แปซng แปฑc =)))Hร Nแปi 40ฤแป C nรณng quรก chแปi quรก ฤแบฅt, cรกc bรกc vรo ngay ฤรขy cho ฤแปก thรจm vรฌ hรกo hoa quแบฃ nhรฉ :v Giแบฃm giรก sรขu cแปฑc cho pgae nhร mรฌnh ฤแบฅy: http://bit.ly/JAMJA-BST-giainhiet"
"Lแป nรy mแปi ngฦฐแปi ฤรฃ trแป tรi nแบฅu mรณn gรฌ ฤแป chiรชu ฤรฃi rแปi nรจ, khoe vรo ฤรขy cho Cooky hแปc hแปi vแปi nhen <3"
"Gแปฃi รฝ cรกch cแบฏt trรกi cรขy ฤแบนp mแบฏt, cรณ thแป dแป trแบป ฤn nhiแปu trรกi cรขy hฦกn ๐๐"
"Panna cotta lร mรณn trรกng miแปng quen thuแปc ฤแบฟn tแปซ nแปn แบฉm thแปฑc ร lแปซng danh. Hฦฐฦกng vแป panna cotta ngแปt nhฦฐng khรดng gแบฏt mร dแปu mรกt, ngแบญy thฦกm vร tan ngay trong miแปng, khi ฤฦฐแปฃc kแบฟt hแปฃp cรนng vแป thanh tแปซ trร xanh, chanh dรขy hay viแปt quแบฅt sแบฝ cho ra mแปt mรณn ฤn khรดng chแป ""mฦฐแปt"" mแบฏt mร cรฒn gรขy nghiแปn ฤแบฟn khรดng ngแป cho xem. Vรo bแบฟp lรm ngay 1 cแปc panna cotta mรกt lแบกnh thรดi nรo <3"
"ฤแป xรญ ngแบงu lรฒi lรฒn ฤแบงu nฤm thแบฏng dc 1 tranh cลฉng thua thรชm 1 tranh em Tแป vร anh ฤแปฅt cho nรณa :D MGPham lร ng khรกc thรฌ cรณ thแป coi lร bรก vฦฐฦกng ngแบกnh thฦฐแปฃng cung nhฦฐng lร anh Tแป toxic masculinity thรฌ chแบฏc lร ฤแบกi trฦฐฦกng phu ko ai mแบทc รกo kรญn thแบฟ cแบฃ lแปt lแปt lแปt #SabiGiyuu #Tแปฤแปฅt"
"Siรชu choaฬng SUฬP CUA LOฬNG GAฬ TRฦฏฬNG NON BฤฬC THAฬO siรชu topping nhiฬn phaฬt theฬmORDER TAฬฃI ฤรY: https://bit.ly/2FgAe66Dรขn cuรดฬng suฬp khรดng ฤฦฐฦกฬฃc boฬ qua ฤiฬฃa chiฬ naฬy nhen <3 Suฬp cua haฬi saฬn ngon siรชu theฬm luรดn, coฬn coฬ loฬng gaฬ trฦฐฬng non hรขฬp, trฦฐฬng bฤฬc thaฬo, chรขn gaฬ nฦฐฬa ฤn hฦกi biฬฃ nhiรชฬu nha :D Nhanh tay ฤฤฬฃt ngay taฬฃi Lixi App ฤรชฬ ฤฦฐฦกฬฃc GIAฬM MAฬฃNH 50% khi order heeee"
