"Nแบฟu biแบฟt cรกch ฦฐแปp ฤแป nฦฐแปng ngon sแบฝ cho ra mรนi thฦกm cรนng mรu sแบฏc ฤแบนp mแบฏt, vแป cแปงa thแปt nฦฐแปng ฤแบญm ฤร khiแบฟn ai ฤn cลฉng mรช mแบฉn ฤแบฅy แบก ๐คค Bรญ quyแบฟt cรณ tแบกi ฤรขy chแป cรฒn chแป bแบกn bแบฏt lแบฅy thแปฑc hiแปn cho bแปฏa tiแปc ฤแบกi lแป nรy โบ๏ธ"
"Giรฒn tan trong miแปng BAฬNH TรM CHIรN thฦกm ngon gรขy nghiรชฬฃn hแปi ฤn cuแปng ฤn vแบทt thรญch mรชORDER TAฬฃI ฤรY: https://bit.ly/2kOnFblNhรฌn ฤฤฉa bรกnh tรดm chiรชn vรng ฦฐฦกm lร ฤรฃ thแบฅy hแบฅp dแบซn rแปi ฤรณ! Bรกnh siรชu to, nรณng hแปi, chiรชn giรฒn rแปฅm, rรกo dแบงu. Bรกnh cรณ tรดm, khoai lang, ฤแบญu xanh, cuแปn chung vแปi rau tฦฐฦกi, chแบฅm mแบฏm แปt chua ngแปt ฤรบng ghiแปn luรดn <3 Anh em lรชn Lixifood order vรชฬ lai rai liรชฬn naฬ!"
"[#CookyVideo - Tแปฅ hแปp sau mรนa dแปch nแบฅu ngay nแปi LแบจU LฦฏฦN CHUA CAY thanh nhiแปt, bแป dฦฐแปกng ๐ฒ]  Cรกch lรm: https://www.cooky.vn/go/r53011 Khรดng chแป thฦกm ngon, ngแปt thแปt mร cรฒn rแบฅt bแป dฦฐแปกng, lแบฉu lฦฐฦกn chiแบฟm trแปn tรฌnh cแบฃm ngay cแบฃ lแบงn ฤแบงu thฦฐแปng thแปฉc. Thแปi gian nghแป dแปch khรดng cรณ dแปp quรขy quแบงn thรฌ nay chฦกi hแบณn nแปi lแบฉu lฦฐฦกn vแปi bรญ kรญp nแบฅu nรy ๐Phรกt video"
"Tin hot lแบฏm nรจ, Apple thu hแปi toรn bแป Iphone cลฉ ฤแป tรกi chแบฟ, ngฦฐแปi dรนng ฤฦฐแปฃc ฤแปi iPhone mแปi vร tแบทng 100 USD nแปฏa nha <3 Nhanh nhanh lแบฅy cลฉ ฤแปi mแปi nรo ^_^"
"Bแบกn nรo ฤang cรณ kแบฟ hoแบกch ฤi ฤร Lแบกt, thรฌ quแบนo vรo ฤแปc bรi review nรy nghen. Viแบฟt chi tiแบฟt chuyแบฟn ฤi 3 ngรy 4 ฤรชm vแป ฤn uแปng, ngแปง nghแป, vui chฦกi, tham quan chแปฅp choแบนt cรกc kiแปu nร."
"Vรด ฤแปch thiรชn hแบก Tร BรNH CANH CรNG CUA - TรM CรNG NGUYรN CON ""xฦฐng bรก"" khแบฏp Sรi GรฒnฤแบถT MรN TแบI ฤรY: http://bit.ly/2MMnZ7yXem ฤแปa chแป: http://bit.ly/31HijiGTa nรณi chแบฃ cแบงn ฤi xa bรกnh canh cua ฤแบฏt tiแปn :v :3 Ad khรกm phรก ra hรng bรกnh canh cรng cua tรดm cรng nguyรชn con siรชu chแบฅt lฦฐแปฃng mร giรก cลฉng แปn nรจ :v :3 1 tรด siรชu nhiแปu topping tรดm, giรฒ, chแบฃ cรก, thแปt cua, cรng cua mแบญp รบ,... ฤn hoรi khรดng hแบฟt luรดn nha <3"
"TOA THUแปC CHแปฎA U.N.G T.H.ฦฏ PHแปI GIAI ฤOแบN IV - HIแปU QUแบข 1- Vแป cรขy sung - thรกi nhแป phฦกi khรด - mแปt nhรบm 2- Cรขy xแบฃ cแบฃ lรก - thรกi nhแป phฦกi khรดt - mแปt nhรบm 3- Lรก ฤu ฤแปง - thรกi nhแป phฦกi khรด - mแปt nhรบm 4- Quแบฃ bแบงn - thรกi nhแป phฦกi khรด - mแปt nhรบm 5- Gแปซng tฦฐฦกi - mแปt cแปง bแบฑng ngรณn tay cรกi - giแบฃ nรกt Nแบฅu uแปng thay trร trong ngรy - Uแปng 30 ngรy cรณ kแบฟt quแบฃ. Nguแปn: coppy thแบงy Thรญch Huแป Minh."
"Nhแปn cฦกm trฦฐa ฤแป dรnh bแปฅng ghรฉ HรNG แปC SIZE KHแปฆNG CHแบคT Lแปช ฤn cho ฤรฃ ฤแปiฤแบถT MรN TแบI ฤรY: http://bit.ly/2YnKXraXem chi tiแบฟt: http://bit.ly/2Kgy5sXAi thรจm แปc buแปi trฦฐa thรฌ cรณ thแป ghรฉ hรng แปc nรy ฤn nha. แปc siรชu tฦฐฦกi ฤรฃ vแบญy cรฒn ฤa dแบกng nแปฏa. Chแบฟ biแบฟn thรฌ ฤแปnh khแปi bรn, khoรกi nhแบฅt lร nฦฐแปc loแบกi chแบฅm แปc แป ฤรขy nรจ ta nรณi nghiแปn bแบฅt chแบฅp luรดn...."
"[#CookyVideo - HแปT VแปT Vร TRแปจNG CรT LแปN BแปC KHOAI MรN ฤรฃ lรm cรกc con dรขn phรกt ฤiรชn chฦฐa? ๐คค๐คค]Cรกch lรm chi tiแบฟt: https://www.cooky.vn/go/r5180ฤแปซng trรกch ad รกc nha, ad chแป giรบp cรกc bแบกn cรณ thรชm nhiแปu mรณn ngon vแปi trแปฉng cรบt lแปn thรดi mร ฤรบng khรดng?"
"Nhรขm nhi ly SแปฎA CHUA NแบพP CแบจM tฦฐฦกi mรกt vแปi ฦฐu ฤรฃi hแบฅp dแบซn chแป cรณ tแบกi LixifoodORDER TแบI ฤรY: https://bit.ly/2M7bXoi Hแปi chแป em ฤแบฃm bแบฃo thรญch mรณn nรy lแบฏm nรจ! Nแบฟp cแบฉm mix vแปi sแปฏa chua dแบปo ฤรฃ thแบฟ cรฒn thรชm topping mรญt, xoรi rแปi dแปซa sแบฅy khรด max phรช luรดn. Order liแปn tแบกi Lixifood nhรขm nhi sฦฐฦกng sฦฐฦกng vแปi chแป em nรฒ!"
"Thรขm niรชn hฦกn 30 nฤm hรng BรNH ฤแบฌP CHแบคM MแบฎM NรM ฤแบญm hฦฐฦกng vแป miแปn Trung ngay giแปฏa lรฒng Sรi Gรฒn ORDER TแบI ฤรY: https://bit.ly/2krdGs0 Vแปi thแปi tiแบฟt thแบฟ nรy mร lรm chiแบฟc bรกnh ฤแบญp ta nรณi phรช thรดi rแปi! Bรกnh ฤแบญp giรฒn rแปฅm chแบฅm vแปi mแบฏm nรชm vแป mแบทn mแบทn, cay cay lร sแป dzรกch. Quรกn cรฒn tแบญp hแปฃp cแบฃ thiรชn ฤฦฐแปng ฤแบทc sแบฃn miแปn Trung nแปฏa nรo bรกnh bรจo, bรกnh bแปt lแปc, mรญt trแปn, ram bแบฏp, mรฌ quแบฃng,... ฤn mแปt lแบงn lร ghiแปn ngay. Anh em hรบ nhau order liแปn tแบกi Lixifood ฤn thแปญ ฤi nha!"
"No cฤng bแปฅng Hร CแบขO - XรU MแบI cแปฑc chแบฅt vแปi ฦฐu ฤรฃi hแบฅp dแบซn chแป cรณ tแบกi LixiApp ORDER TแบI ฤรY: https://bit.ly/2GcXd2o Mแบฅy viรชn hรก cแบฃo, xรญu mแบกi แป ฤรขy siรชu chแบฅt lฦฐแปฃng luรดn, viรชn nรo viรชn nแบฅy bรฉo รบ, vแป mแปng, nhรขn ฤแบงy thแปt thรชm hแบกt bแบฏp bรชn trong nแปฏa bao ghiแปn. ฤแบทt liแปn tแบกi LixiApp nhรขm nhi xแบฟ chiแปu nรจ!"
"Sรi Gรฒn mรฌnh quรก nhiแปu quรกn cร phรช chแบฅt. ฤรขy lร 1 trong nhแปฏng quรกn view chแบฅt, decor ฤแปnh tha hแป cho bแบกn trแบป chแปฅp choแบนt sแปng แบฃo nร."
"[Bแบญt mรญ cรกch trแปng dรขy SฦฏฦNG SรM vร cรกch tแปฑ lรm sฦฐฦกng sรขm ngay tแบกi nhร] Dรขy sฦฐฦกng sรขm thแปฑc chแบฅt rแบฅt dแป trแปng, dแป sแปng vรฌ chรบng thuแปc loแบกi dรขy leo, tuy nhiรชn nแบฟu trแปng sai cรกch cรณ thแป sแบฝ khiแบฟn cรขy chแบฟt. Tham khแบฃo cรกch trแปng vร chแบฟ biแบฟn ngay dฦฐแปi ฤรขy nhรฉ! ------------- Tแบฃi App Cooky ฤแป cรณ nhแปฏng trแบฃi nghiแปm tuyแปt vแปi trรชn smartphone! Cooky iOS app: bit.ly/CookyiOSApp Cooky Android app: bit.ly/CookyAndroidApp"
"Ngon bรก ฤแบกo phแบงn XรI Gร Xร XรU thฦกm ngon, nรณng hแปi lรณt dแบก xแบฟ chiแปu  ORDER TแบI ฤรY: https://bit.ly/336MHn5Chiแปu chiแปu mร cรณ hแปp xรดi gร xรก xรญu nรณng hแปi thรฌ ngon phแบฃi biแบฟt nร! Hแปp xรดi ฤแบงy แปฅ, hแบกt xรดi dแบปo, thฦกm vร khรดng bแป khรด. Thแปt ฦฐแปp vแปซa vแป thรชm nฦฐแปc sแปt sแปn sแปt, ฤแบญm ฤร bรก chรกy luรดn. Anh em nhรo dรด order tแบกi Lixifood cแปฉu ฤรณi buแปi chiแปu vแปi ฦฐu ฤรฃi giแบฃm ฤแบฟn 50% nรจ!"
"Cuแปc sแปng tแบฅt bแบญt hแปi hแบฃ khiแบฟn ta bแป quรชn mแบฅt ฤam mรช nแบฅu nฦฐแปng cแปงa mรฌnh cรนng sแป thรญch ฤi ฤรขy ฤi ฤรณ ๐ณ๐ตโน๏ธVแบญy sao khรดng thแปญ lรm mแปi mรฌnh bแบฑng cรกch ฤแบฟn vแปi lแปp hแปc dรฃ ngoแบกi vแปซa thแปa ฤam mรช Nแบฅu ฤn, vแปซa hรญt bแบงu khรดng khรญ Mแปi Mแบป bแบฑng trแบฃi nghiแปm Thรบ Vแป nรy nรo! ๐"
"Cแปฑc phแบฉm lร ฤรขy HแปT VแปT LแปN NฦฏแปNG MUแปI แปT nhรฌn thรจm rแปt nฦฐแปc miแบฟngXem chi tiแบฟt TแบI ฤรY: https://app.lixibook.vn/EeRQs97wฤรชm hรดm chแปu sao nแปi ๐ Hแปt vแปt lแปn thรชm mแปก hรnh, ฤแบญu phแปng, rau rฤm nฦฐแปng lรชn thฦกm bรนng chรกy, ฤn ฤรช mรช chแป chแบฃ ฤรนa (y) ๐ &lt;3"
"Tรญn ฤแป cรกc mรณn dแปซa khรดng thแป bแป qua hรng ngรn cรดng thแปฉc mรณn ฤn vแบทt tแปซ DแปชA siรชu ngon nรy ฤรขu nha. Cรกch lรm cแปฑc kรฌ ฤฦกn giแบฃn, lฦฐu ngay ฤแป ngรy nรณng lแบฅy ra triแปn nรo mแปi ngฦฐแปi ๐๐"
"Bแบกn ฤรฃ biแบฟt ฤn thแปt nฦฐแปng ฤรบng cรกc, chuแบฉn Hรn chฦฐaNhรฌn chแป Soobin ฤn nรจ#themmotchut"
"[#CookyVideo - Cho ngรy mแปi nฤng lฦฐแปฃng trรn ฤแบงy vแปi mรณn BรNH Cร HแปI  bรฉo ngแบญy, thฦกm ngon]  Cรดng thแปฉc: https://www.cooky.vn/go/r38727 Hแบณn lร cรกc bรฉ nhร bแบกn sแบฝ rแบฅt thรญch lแปp bรกnh cแบฏn vรo giรฒn tan trong miแปng, mแปm thฦกm bรชn trong, khรดng cรฒn mรนi tanh cแปงa cรก hแปi mร thay vรo ฤรณ lร vแป bรฉo bรฉo, thฦกm ngon ฤแบทc biแปt ๐๐๐"
"Giรก ฤแป chฦฐng chฦกi Cร VIรN CHIรN Tร HON 1K ฤแปc lแบก แป Sรi GรฒnXem ฤแปa chแป: https://goo.gl/s4uA8WXe cรก viรชn chiรชn nhแป xรญu, cฦฐng xแปu hร <3 ๐ (y) Cรก viรชn, xรบc xรญch, trแปฉng cรบt, chแบฃ giรฒ, hoรnh thรกnh ...size mini chแป 1k thรดi, chiรชn vแปi bฦก thฦกm lแปซng hร, chan thรชm sแปt bฦก, chแบฅm tฦฐฦกng แปt ฤn mรช ly nha ๐ฅ ๐ฅ ๐ฎ &lt;3"
"Chแบฅt quรก phแบฃi share NแปI LแบจU TOKBOKKI HแบขI SแบขN CHแป 199K topping ฤแบงy nhรณc chรฉn hoรi khรดng vฦกiXem chi tiแบฟt: https://app.lixibook.vn/lahP0UQKKhรดng tin ฤฦฐแปฃc chแป 199k lร ฤn ngแบญp mแบทt nแปi lแบงu tokbokki topping ฤแบงy แปฅ tokbokki thฦฐแปng, tokbokki nhรขn phรด mai, chแบฃ cรก Hรn quแปc, xรบc xรญch, bแบกch tuแปc, ba chแป bรฒ mแปน vร 2 con hรu to nแปฏa luรดn ฤรณ nha ^_^ Hรดm nรo lรฉp vรญ kรฉo nhau tแปi ฤรขy chรฉn no nรช luรดn nรจ <3"
"Cรกc chแป em rแบงn rแบงn vรฌ mรณn chรจ DฦฏแปNG NHAN giรบp thanh nhiแปt, mรกt da quรก thแบงn thรกnh. Cรฒn ad thรฌ ghiแปn vรฌ mรณn chรจ quรก ngon. Vแป ngแปt thanh mรกt, mรนa nรy ฤแป tแปง lแบกnh ฤn phรช cแปฑc luรดn แบก๐๐ mรกt tแบญn ruแปt lร cรณ thแบญt ฤรณ cรกc chแป ฦกi ๐คฃ๐คฃLฦฐu lแบกi lรm bแป tแปง lแบกnh uแปng dแบงn nhรฉ! ๐"
"๐คแป Bรฌnh Thuแบญn ad thแบฅy nแบฅu canh chua dรนng lรก me non thay cho me chรญn.Khรดng biแบฟt mแบฅy vรนng khรกc cรณ nแบฅu vแบญy khรดng, cแบฃ nhร chia sแบป vแปi ad nhรฉ! ๐"
"Nhแปฏng thรกng ฤแบงu, mแบน bแบงu rแบฅt cแบงn cรณ mแปt thแปฑc ฤฦกn ฤแปง chแบฅt, khoa hแปc ฤแป ฤแบป con ra ฤฦฐแปฃc dแป dรng vร xinh xแบฏn khแปe mแบกnh ๐๐Vแบญy mแบน bแบงu cแบงn ฤn nhแปฏng mรณn bแปi bแป gรฌ? Cรนng tรฌm hiแปu ฤแป chฤm sรณc mแบน vร bรฉ tแปt nhแบฅt nha cแบฃ nhร ๐ฅฐ"
"Nแบฅu mรณn bรบn gรฌ cho cแบฃ nhร ฤn sรกng? Cรนng xem bแป sฦฐu tแบญp cรดng thแปฉc dฦฐแปi ฤรขy nhรฉ ๐Link: https://www.cooky.vn/go/c585762"
"BรI THUแปC DรN HAY.LฦฏU LแบI KHI CแบฆN. Nhแปฏng ai ฤang bแป bฦฐแปu Cแป bฦฐแปu Mแปก. Nhแปฏng chแป em ฤang bแป khแปi U hay U nang แป ngแปฑc. Thรฌ trรกi Bรฌnh Bรกt xanh chรญnh lร cแปฉu tinh cแปงa nhแปฏng ngฦฐแปi ฤang mแบฏc nhแปฏng bแปnh nhฦฐ trรชn. Hรกi trรกi Bรฌnh Bรกt xanh.Sau ฤรณ nฦฐแปng chรกy lรชn,lแบฅy tay nแบฏm thแบฅy vแปซa ฤแปง แบฅm.Thรฌ lฤn trรกi Bรฌnh Bรกt vรo chแป ฤau vร khแปi U.Nแบฟu Bฦฐแปu ฤแปc แป cแป khi lฤn vรo nรณ sแบฝ ฤแบฉy ฤแปc tแป ra lรm cho mรฌnh cรณ triแปu trแปฉng nรดn รณi. Cรกc bแบกn cแป gแบฏng lรm nhรฉ.Vรฌ nรณ rแบฅt hiแปu quแบฃ khรดng cแบงn phแบฃi mแป. Nhแปฏng ai ฤang bแป hay ฤรฃ bแป hรฃy lรm ngay vรฌ ฤรฃ cรณ rแบฅt nhiแปu ngฦฐแปi chแปฏa theo cรกch nรy khแปi rแปi. Ngฦฐแปi thรขn cแปงa mรฌnh bแป แป ngแปฑc รกp dแปฅng theo cรกch nรy cลฉng ฤรฃ khแปi.Mร khรดng tแปn kรฉm .Mong cho nhแปฏng ai ฤang bแป ฤแปc ฤฦฐแปฃc bรi thuแปc dรขn gian hay nรy."
"Lแป diแปn mรณn mแปi siรชu ฤแปc lแบก SแปฎA CHUA ฤฦฏแปNG ฤEN mรกt ngแปt rแปฅng tim ๐๐ ๐ฃฤแปa chแป+Review: https://app.lixibook.vn/azg9MB7ZSแปฑ kแบฟt hแปฃp ฤแปc ฤรกo lแบงn ฤแบงu xuแบฅt hiแปn cแปงa sแปฏa chua vร ฤฦฐแปng ฤen tแบกo ra mแปt hฦฐฦกng vแป thฦกm ngon khรณ tแบฃ, ngoรi ra cรฒn cรณ ฤแบญu phแปng, dแปซa sแบฅy vร bรกnh แปng giรฒn giรฒn vui miแปng lแบฏm nghen ๐คฉ๐#lixibook #reviewcotam #trv #ddauSG #ddau #SaiGon"
"ฤแปi giรณ tiแปm PIZZA PHรP HOMEMADE cฦฐฬฃc chแบฅt cho bแปฏa tแปi แบฅm cรบng ORDER TแบI ฤรY: https://bit.ly/2m9eKRS Tรดฬi nay ฤแปi giรณ order pizza vแป ฤn nรจ cแบฃ nhร ฦกi <3 Bรกnh pizza homemade nรณng hแปi, ฤa dแบกng cรกc loแบกi nhรขn chuแบฉn vแป Phรกp luรดn รก ^_^ Cรฒn chแป gรฌ nแปฏa order ngay ฤแป nhแบญn ngay ฦฐu ฤรฃi giแบฃm ฤแบฟn 40% siรชu ฤรฃ!"
"""Huyแปn thoแบกi Hร Nแปi"" bay vแป Sรi Gรฒn BรNH Mร KEM TRแปจNG - CAFE BรNG ngon ฤรบng ฤiแปuฤแบถT MรN TแบI ฤรY: http://bit.ly/31EDyldXem ฤแปa chแป: https://goo.gl/Nnb53fLรขu lรขu ฤแปi gu tรฌm chรบt yรชn tฤฉnh bรฌnh lแบทng thรฌ ghรฉ ฤรขy liแปn :v :3 hรng cafe siรชu chแบฅt gรขy nghiแปn vแปi cafe trแปฉng, cafe bรดng, bรกnh mรฌ kem sแปฏa.....ฤรบng ฤiแปu ฤi 1 lแบงn ghiแปn nรจ :v :3"
"Bรฉo ngแบญy phรกt thรจm BรNH TRรNG NฦฏแปNG BแบฎP PHร MAI ngon nghiแปn khรณ caiฤแบถT MรN TแบI ฤรY: http://bit.ly/2VqA9pTXem ฤแปa chแป: http://bit.ly/2VCy8qMฤn bรกnh trแบฏng nฦฐแปng nhiแปu mร lแบงn ฤแบงu biแบฟt mรณn nรy luรดn โค๏ธ๐๐ bรกnh trรกng nฦฐแปng bแบฏp siรชu thฦกm luรดn, topping cรณ thแปt bแบฑm, xรบc xรญch nhuyแปn, ruแปc, hรnh phi, hรnh lรก vร ฤแบทc biแปt lร cแปฑc nhiแปu bแบฏp ๐ฝ๐ฎ"
"Chแป 10K thรดi แบก CHร NรNG ฤแปฆ LOแบI 40 NฤM khรกch ฤรดng khรดng ngแปt แป Sรi GรฒnฤแบถT MรN TแบI ฤรY: http://bit.ly/2GsddN8Xem ฤแปa chแป: https://goo.gl/AudSkLTแปi mรกt trแปi ra ฤรขy kรฉo ghแบฟ lรm chรฉn chรจ nรณng lร ฤรบng bรi luรดn. ฤแปng giรก 10k mแปi loแบกi nhรฉ: chรจ bแบฏp, chรจ chuแปi, chรจ khoai mรดn... Mแบกi dzรด... Mแบกi dzรด..."
"Tแปซ nay khรดng sแปฃ mua trรบng CHแบข CHIรN mแบฅt vแป sinh, cรณ cรกch lรm ฤฦกn giแบฃn tแบกi nhร vแปซa dai ngon, an toรn ฤn vแปi mรณn gรฌ cลฉng ngon. Mรนa dแปch nรy chแป cแบงn cรณ bรกt cฦกm nรณng vแปi chแบฃ chiรชn lร cลฉng ฤแปง no say. ๐ฏ๐"
"[#CookyVideo - Tแปฑ tay lรm TRร y nhฦฐ ngฦฐแปi miแปn Trung nha cรกc bแบกn! ๐๐]Cรกch lรm chi tiแบฟt: https://www.cooky.vn/go/r47238Sแบตn tiแปn lแป แป nhร lรm vรi cรขy trรฉ, lรm ฤแป nhแบฏm, ฤem trแปn ฤn chฦกi cลฉng ngon phแบฟt ฤแบฅy cรกc bแบกn ha!"
"[#CookyVideo - Chinh phแปฅc SแปฎA ฤแบฌU XANH Lร DแปจA bรฉo thฦกm cho cแบฃ nhร 1 ly chแบฅt lฦฐแปฃng mแปi ngรy ๐ถ] Cรดng thแปฉc: https://www.cooky.vn/go/r49735Cรณ niแปm ฤam mรช lแปn vแปi loแบกi sแปฏa bแป dฦฐแปกng nรy nhฦฐng lแบกi mฦก hแป, hoรi nghi vแป chแบฅt lฦฐแปฃng bรชn ngoรi bรกn. Giแป thรฌ ฤรฃ cรณ bรญ quyแบฟt nแบฅu sแปฏa ngon rแปi, khรดng lo nแปฏa nhรฉ ๐๐"
"[#CookyVideo - ฤแบฟn vแปi แบฉm thแปฑc xแปฉ Huแบฟ qua mรณn Chรจ Bแปt Lแปc Heo Quay ฤแปc ฤรกo]Cรดng thแปฉc: https://www.cooky.vn/go/r43001Vแป dai dai, vแป ngแปt mแบทn hรฒa quyแปn cรนng sแปฃi gแปซng nแปng tแบกo nรชn mรณn chรจ vรด cรนng thรบ vแป. Nแบฟu ai trรณt phแบฃi lรฒng hoแบทc muแปn nแบฟm thแปญ thรฌ ฤแปซng vแปi lฦฐแปt qua mร khรดng lฦฐu lแบกi tuyแปt chiรชu lรm mรณn chรจ nรy nhรฉ ๐"
"Detox khรดng hแป khรณ uแปng mแปt chรบt nรo nแบฟu cรกc chแป biแบฟt cรกch phแปi cรกc loแบกi trรกi cรขy, rau cแปง ฤรณ แบก ๐๐๐ Lฦฐu cรดng thแปฉc lแบกi vร triแปn liแปn cรกc chแป nhรฉ, ฤแบฃm bแบฃo hiแปu quแบฃ vร tแปt cho sแปฉc khแปe lแบฏm แบก ๐"
"Dแบฏt nhau trรกnh nรณng Sรi Gรฒn tแบกi Gong Cha vแปi ฦฐu ฤรฃi hแบฅp dแบซn chแป cรณ tแบกi LixifoodChแป รกp dแปฅng khi mua TแบI ฤรY: https://bit.ly/2ZjGPEU Anh em lแบญp team dแบฏt nhau ฤi cร kรช tแบกi Gong Cha hoy nร ๐๐ Vแปซa nhรขm nhi trร sแปฏa thฦกm ngon, bรฉo ngแบญy lแบกi cรฒn cรณ mรกy lแบกnh tha hแป trรกnh nรณng nแปฏa! ฤรฃ thแบฟ lแบกi cรณ ฦฐu ฤรฃi ฤแปc quyแปn tฤฬฃng laฬฃi 10% Lixi vaฬo taฬi khoaฬn Lixi khi mua Cash voucher Gong Cha 50k naฬ <3 Quaฬ tiรชฬt kiรชฬฃm luรดn neฬ, miฬnh triรชฬn liรชฬn luรดn heeeee!"
"Chแปn mรณn mแปi tay trฦฐแปc HรNG BUFFET Cร VIรN CHIรN CHแป Tแปช 5K topping nhiแปu vรด sแป kแปXem ฤแปa chแป: http://bit.ly/2NrXODmNhรฌn hoa cแบฃ mแบฏt chรณng cแบฃ mแบทt, mรณn nรo cลฉng muแปn ฤn hแบฟt ร :P Cรก viรชn chiรชn tแปฑ chแปn topping xรo bแบฏp thฦกm ngon khรณ cฦฐแปกng luรดn แบฅy ^_^ Tแปฅ tแบญp 500 anh em ra ฤรขy lร quรชn ฤฦฐแปng vแป luรดn nha <3"
"[#CookyVideo - ฤรฃ ฤn thรฌ vฦฐฦกng mรฃi hฦฐฦกng vแป BรNH HแปI CHรO LรNG ฤแบฅt Bรฌnh ฤแปnh ๐๐]Cรกch lรm chi tiแบฟt: https://www.cooky.vn/go/r47375Hรจ ฤi du lแปch vแป mร vแบซn cรฒn thรจm mรณn ngon nรy thรฌ chแบฏc chแบฏn khรดng thแป bแป qua mรณn ฤn nรy rแปi ฤรบng khรดng? Lฦฐu ngay cรดng thแปฉc ฤแป nแบฅu nhรฉ!"
"Khรดng nghฤฉ ฤแบฟn chiแบฟc BรNH CHUแปI NฦฏแปNG trแปฉ danh miแปn Tรขy lแบกi cรณ cรกch lรm ฤฦกn giแบฃn thแบฟ nรy luรดn. Chแป cแบงn mแปt cรกi NแปI CฦM ฤIแปN nhแป nhแป lร ฤฦฐแปฃc khรดng cแบงn lรฒ nฦฐแปng phiแปn phแปฉc. Thแปญ ngay nhรฉ chแป em ๐"
