"HรY LฦฏU LแบI: Ngฦฐแปi xฦฐa ฤรฃ tแปซng rฤn dแบกy! 1. ฤn no khรดng gแปi ฤแบงu, ฤรณi khรดng tแบฏm. Rแปญa mแบทt nฦฐแปc lแบกnh, vแปซa ฤแบนp vแปซa khแปe. Mแป hรดi chฦฐa khรด, ฤแปซng tแบฏm nฦฐแปc lแบกnh. ฤรกnh rฤng nฦฐแปc แบฅm, chแปng รช chแบฏc rฤng. 2. ฤn gแบกo cรณ trแบฅu, thแปฉc ฤn cรณ chแบฅt xฦก . Nam khรดng thแป thiแบฟu rau hแบน, nแปฏ khรดng thแป thiแบฟu ngรณ sen. Cแปง cแบฃi trแบฏng, sแปng khรดng tแปt nhฦฐng chรญn thรฌ bแป. ฤn khรดng quรก no, no khรดng nรชn nแบฑm. 3. Dฦฐแปกng sinh lร ฤแปng, dฦฐแปกng tรขm lร tฤฉnh. Tรขm khรดng thanh tแปnh, ฦฐu tฦฐ vแปng tฦฐแปng dแป nแบฃy sinh. Tรขm thแบงn an bรฌnh, bแปnh sao ฤแบฟn ฤฦฐแปฃc. Nhแบฏm mแบฏt dฦฐแปกng thแบงn, tฤฉnh tรขm รญch trรญ. 4. Dฦฐแปฃc bแป thแปฑc bแป, ฤแปซng quรชn tรขm bแป. Coi tiแปn nhฦฐ cแป, coi thรขn nhฦฐ bแบฃo. khรณi hun chรกy lแปญa, tแปt nhแบฅt khรดng ฤn. Chiรชn dแบงu ngรขm ฦฐแปp, รญt ฤn thรฌ tแปt. 5. Cรก thแปi tรดm rแปฏa, lแบฅy mแบกng oan gia. ฤn mแบทc giแปฏ แบฅm, nhแบฅt thรขn lร xuรขn. Lแบกnh chแป chแบกm rฤng, nรณng chแป chแบกm mรดi. ฤแป chรญn mแปi ฤn, nฦฐแปc chรญn mแปi uแปng. 6. ฤn nhiแปu rau quแบฃ, รญt ฤn ฤแป thแปt. ฤn uแปng chแปซng mแปฑc, ngแปง dแบญy ฤรบng giแป. ฤแบงu nรชn ฤแป lแบกnh, chรขn nรชn giแปฏ แบฅm. Vui chฦกi biแบฟt ฤแปง, khรดng cแบงu an dแบญt. 7. Dฦฐแปกng sinh lร cแบงn cรน, dฦฐแปกng tรขm lร tฤฉnh tแบกi. 8. Ngฦฐแปi ฤแบฟn tuแปi giร, thรฌ phแบฃi rรจn luyแปn, ฤi bแป chแบกy chแบญm, luyแปn cรดng mรบa kiแบฟm; ฤแปซng sแปฃ giรก lแบกnh, quรฉt sแบกch sรขn nhร, hแปi hแปa thรชm vui, tแบฅm lรฒng rแปng mแป. 9. Nghe tiแบฟng gร gรกy, ฤแปซng cแป nแบฑm thรชm, trแปng hoa nuรดi chim, ฤแปc sรกch ngรขm thฦก; chฦกi cแป hรกt kแปch, khรดng ham phรฒng the, viแปc tฦฐ khรดng nhแป, khรดng chiแบฟm lแปฃi riรชng. 10. แบจm thแปฑc khรดng tham, bแปฏa tแปi ฤn รญt, khi ฤn khรดng nรณi, khรดng nรชn hรบt thuแปc; รญt muแปi รญt ฤฦฐแปng, khรดng ฤn quรก mแบทn, รญt ฤn chแบฅt bรฉo, cฦกm khรดng quรก nhiแปu. 11. Mแปi ngรy ba bแปฏa, thแปฉc ฤn phรน hแปฃp, rau xanh hoa quแบฃ, ฤn nhiแปu khรดng sแปฃ; ฤรบng giแป ฤi ngแปง, ฤแบฟn giแป thรฌ dแบญy, nแบฑm dแบญy nhแบน nhรng, khรดng gแบฅp khรดng vแปi. 12. Uแปng rฦฐแปฃu cรณ ฤแป, danh lแปฃi chแป tham, chuyแปn thฦฐแปng khรดng giแบญn, tแบฅm lรฒng phแบฃi rแปng. 13. Tรขm khรดng bแปnh, nรชn phรฒng trฦฐแปc, tรขm lรฝ tแปt thรขn thแป khแปe mแบกnh; tรขm cรขn bแบฑng, phแบฃi hiแปu biแบฟt, cแบฃm xรบc แปn ฤแปnh bแปnh tแบญt รญt. 14. Luyแปn thรขn thแป, ฤแปng cรนng tฤฉnh, cuแปc sแปng hรi hรฒa tรขm khแปe mแบกnh; phแบฃi thแปฑc dฦฐแปกng, no tรกm phแบงn, tแบกng phแปง nhแบน nhรตm tแปฑ khai thรดng. 15. Ngฦฐแปi nรณng giแบญn, dแป giร yแบฟu, thแป lแป thรญch hแปฃp ngฦฐแปi ngฦฐแปi vui; thฦฐแปng thแปฉc thฦฐ hแปa, bรชn suแปi thแบฃ cรขu, lแปฑa chแปn sแป thรญch tแปฑ do chฦกi. 16. Dรนng ฤแบงu รณc, khรดng mแปt nhแปc, bแปt lo dฦฐแปกng tรขm รญt nรกo nhiแปt; cรณ quy luแบญt, sแปฉc khแปe tแปt, cuแปc sแปng thฦฐแปng ngรy phแบฃi hรi hรฒa. 17. Tay vแบญn ฤแปng, tแปt cho nรฃo, phรฒng ngแปซa bแป lแบกnh vร cแบฃm cรบm. 18. Mรนa hรจ khรดng ngแปง trรชn ฤรก, mรนa thu khรดng ngแปง trรชn phแบฃn. Mรนa xuรขn khรดng hแป rแปn, mรนa ฤรดng khรดng che ฤแบงu. Ban ngรy hoแบกt ฤแปng, tแปi ngแปง รญt mฦก. 19. Tแปi ngแปง rแปญa chรขn, hฦกn uแปng thuแปc bแป. Buแปi tแปi mแป cแปญa, hแป ngแปง lร say. Tham mรกt khรดng chฤn, khรดng bแปnh mแปi lแบก. 20. Ngแปง sแปm dแบญy sแปm, tinh thแบงn sแบฃng khoรกi, tham ngแปง tham lแบกc, thรชm bแปnh giแบฃm thแป. Tranh cรฃi buแปi tแปi, ruแปt nhฦฐ sรกt muแปi. 21. Mแปt ngรy ฤn mแปt ฤแบงu heo, khรดng bแบฑng nแบฑm ngแปง ngรกy trรชn giฦฐแปng. 22. Ba ngรy ฤn mแปt con dรช, khรดng bแบฑng rแปญa chรขn rแปi mแปi lรชn giฦฐแปng. 23. Gแปi ฤแบงu chแปn khรดng ฤรบng, cรng ngแปง ngฦฐแปi cรng mแปt. Tรขm ngแปง trฦฐแปc, ngฦฐแปi ngแปง sau, ngแปง vแบญy sแบฝ thรnh mแปน nhรขn. 24. ฤแบงu hฦฐแปng giรณ thแปi, แบฅm รกp dแป chแปu, chรขn hฦฐแปng giรณ thแปi, hรฃy mแปi thแบงy lang. 25. Khรดng ngแปง nฦกi ngรต hแบปm, ฤแปc nhแบฅt khi giรณ lรนa. 26. ฤi ngแปง khรดng thแบฏp ฤรจn, sรกng dแบญy khรดng chรณng mแบทt. 27. Muแปn ngแปง ฤแป tแบฅm thรขn nhแบน nhรตm, chรขn khรดng hฦฐแปng tรขy ฤแบงu khรดng hฦฐแปng ฤรดng. Sฦฐu tแบงm."
"Ghiแปn khรณ bแป แป BรNH Mร PHร MAI TAN CHแบขY bรฉo ngแบญy vแปi ฦฐu ฤรฃi hแบฅp dแบซn chแป cรณ tแบกi Lixifood ORDER TแบI ฤรY: https://bit.ly/2jRWQ5k Thรกnh nรo ghiแปn phรด mai bรฉo ngแบญy nhรo dรด nรจ! Nguyรชn แป bแปฑ chแบฃng, phแบงn bรกnh mรฌ mแปm, thฦกm phแปฉc, bรชn trong lร phรด mai bรฉo ngแบญy. Chแปi ฦกi ฤn lแบงn lร ghiแปn ngay รก! ฤรฃ thแบฟ, Lixifood lแบกi ฤang cรณ ฦฐu ฤรฃi giแบฃm ฤแบฟn 40% nรชn tranh thแปง hรบ team order ฤn xแบฟ chiแปu ฤi nรจ!"
"Tแปng hแปฃp cรดng thแปฉc cรกc mรณn ฤn ngon ฤแบญm ฤร ฤฦฐa cฦกm ๐คค๐คคXem thรชm bแป cรดng thแปฉc: https://www.cooky.vn/go/c568806"
"BรI THUแปC GแปชNG TRแป DแปจT ฤIแปM HO Sแป MลจI CHO CON Lรm theo cรกch nรy, con ho, sแป mลฉi, rรกt hแปng lรขu ngรy cลฉng khแปi. Nhiแปu cha mแบน hแปi bรกc sฤฉ cรกch nรo chแปฏa ฤฦฐแปฃc ho sแป mลฉi cho con an toรn mร hiแปu quแบฃ. Bรกc sฤฉ xin chia sแบป bรi thuแปc ngรขm chรขn vแปi nฦฐแปc gแปซng rแบฅt nแปi tiแบฟng sau ฤรขy. Nguyรชn liแปu: - Gแปซng giร: 50g - Muแปi hแปt: 20g - Nฦฐแปc: 1 lรญt - Nแปi, thauโฆ  Cรกch lรm: Gแปซng chแปn cแปง giร rแปญa sแบกch dฦฐแปi vรฒi nฦฐแปc.Cho gแปซng vรo cแปi giรฃ nhแป, nแบฅu chung vแปi 1 lรญt nฦฐแปc vร muแปi hแปt.Khi nฦฐแปc sรดi thรฌ vแบทn nhแป lแปญa, ฤแป chแปซng 5 phรบt cho tinh chแบฅt gแปซng ra hแบฟt sau ฤรณ tแบฏt bแบฟp vร ฤแป nguแปi khoแบฃng 40 ฤแป lร cรณ thแป sแปญ dแปฅng ฤฦฐแปฃc.  Cรกch dรนng: Trฦฐแปc khi ฤi ngแปง, mแบน hรฃy ฤแป nฦฐแปc gแปซng แบฅm vแปซa ฤun ra thau ฤแป ngรขm chรขn cho bรฉ, vแปซa ngรขm vแปซa massage gan chรขn cho con, nแบฟu mแบน biแบฟt huyแปt dลฉng huyแปn thรฌ bแบฅm cho con sแบฝ cรณ tรกc dแปฅng nhanh hฦกn. Tuy nhiรชn, nแบฟu khรดng biแบฟt thรฌ mแบน chแป cแบงn massage chรขn cho bรฉ lร ฤแปง. Cรกch massage: dรนng ngรณn tay cรกi tรฌ lรชn mu bรn chรขn cแปงa bรฉ, cรกc ngรณn cรฒn lแบกi bรณp nhแบน vรo gan bรn chรขn, ฤi dแปc tแปซ gรณt chรขn lรชn gแบงn ngรณn chรขn. Cลฉng cรณ thแป dรนng gแปซng chร vรo lรฒng bรn chรขn cแปงa bรฉ.Khi nฦฐแปc hแบฟt แบฅm, mแบน lแบฅy chรขn con ra ฤแบทt vรo khฤn sแบกch, lau khรด 2 chรขn con xong nhแบน nhรng massage bแบฑng dแบงu trรm ฤแป dแบงu thแบฅm vร lan tแปa vรo cรกc huyแปt ฤแบกo แป chรขn bรฉ. Sau ฤรณ mang vแป chรขn cho con rแปi ฤi ngแปง.Kiรชn trรฌ sแปญ dแปฅng ฤแปu ฤแบทn mแปi ngรy mแปt lแบงn, trong 3 ngรy liรชn tiแบฟp cรกc triแปu chแปฉng ho, sแป mลฉi cแปงa bรฉ sแบฝ khแปi. Cแปฑc kแปณ hiแปu nghiแปm."
"[#CookyVideo - Nghแป lแป tแบญn 5 ngรy, cรนng ngฦฐแปi yรชu nแบฅu LแบจU GHแบธ KIM CHI ฤn nhรฉ! ๐ค๐ค]Cรกch lรm chi tiแบฟt: https://www.cooky.vn/go/r46580Lรm sao mร cฦฐแปกng lแบกi vแปi mรณn ngon nรy ฤรขy nhแป? Thแบฅy cรณ ghแบน lร ฤรฃ thรญch rแปi, thรชm nฦฐแปc lแบฉu nแบฅu vแปi kim chi chua chua cay cay nแปฏa, ฤรฃ ฦกi lร ฤรฃ luรดn nha!"
"Sแปฏa chฦฐa mแปm mแปm, bรฉo ngแบญy tan chแบฃy trong miแปng vแปi ngรขy ngแบฅt hฦฐฦกng thฦกm vร ฤแป dแบปo mแปm sแปฏa chua sแบฝ khiแบฟn bแบกn tan chแบฃy trรกi tim khi nแบฟm thแปญ miแบฟng bรกnh nรy mแบฅt thรดi.โบ โบ Cรดng thแปฉc: https://www.cooky.vn/go/r35497"
"[#CookyVideo - ฤn theo phong cรกch phฦฐฦกng Tรขy vแปi mรณn BแบฎP XรO PHร MAI bรฉo ngแบญy ๐ค๐ค]Cรกch lรm: https://www.cooky.vn/go/r29237Chแป cแบงn vรi trรกi bแบฏp, phรด mai cรนng รญt nguyรชn liแปu ฤรฃ cรณ ngay mรณn ฤn vแบทt bรฉo ngแบญy hแบฅp dแบซn. ฤฦกn giแบฃn, dแป lรm nแปฏa, quรก tuyแปt cho buแปi ฤn vแบทt tรนy hแปฉng ฤรบng hรดng cรกc tรญn ฤแป ๐"
